phrase_id,balise_lieu_obj,balise_lieu_loc,balise_act,balise_doc,balise_perc,balise_tps,balise_dyn,phrase
1,,,,,,, se sont accrus ,"Depuis 1880 Paris et son agglomération  se sont accrus  de 5 millions d' habitants , croissance exceptionnellement rapide , sans organisation ni méthode , alors que l' arrivée massive des provinciaux aurait exigé une politique consciente et volontaire. "
2,,,,,,, se sont édifiés ,Des milliers de logements sans confort  se sont édifiés  dans un incroyable désordre . 
3,,,,,,," l' embellissement de Paris ,","Si au cours de notre histoire , chaque génération apporta sa contribution à  l' embellissement de Paris , les cent dernières années n'ont ajouté à , la plus belle ville du monde , qu'une banlieue indifférenciée , sans style et sans âme . "
5,,,,,,," s'aggrave ,","Les circonstances ont voulu que les études entreprises par quelques hommes clairvoyants et qui auraient évité que cette situation ne  s'aggrave , voient seulement le jour à la veille de la dernière guerre . "
7,,,,,,," le renouveau de la France , la croissance démographique de l' agglomération parisienne a imposé un immense effort de construction .","Après dix années sombres où se prépara puis s'accomplit  le renouveau de la France , la croissance démographique de l' agglomération parisienne a imposé un immense effort de construction . "
8,,,,,,, ont surgi ,De véritables villes nouvelles  ont surgi  à un rythme jamais atteint . 
10,,,,,,," l' équipement d' une agglomération urbaine ,","Mais il faut régler aussi la très importante question de  l' équipement d' une agglomération urbaine , aussi peuplée que la Suède , et déterminer les bases sur lesquelles doit évoluer le Paris futur . "
11,,,,au plan <dyn,,,,C'est l' objectif que le Gouvernement assignait le 31 décembre 1958au plan > d' Aménagement et d' Organisation Générale de la Région Parisienne. 
12,,,,,,, l' organisation et la prévision qu'un Pays vivant ,"Élaboré en tenant compte des études antérieures par tous les Ministères étroitement associés , soumis à l' approbation des collectivités locales de la Région Parisienne , il met fin aux procédés d' interventions partielles qui n'aboutissaient qu'à une inefficace dilution des crédits . Il rend désormais possible  l' organisation et la prévision qu'un Pays vivant  se doit de réserver à la première de ses régions . "
13,,,,ce plan,,, le Devenir de Paris.,"En approuvantce planle 6 août 1960 , soit cent ans après l' ère des derniers grands travaux , le Gouvernement a marqué sa volonté qu'un document unique , de conception simple et large , détermine  le Devenir de Paris. "
15,,,,,,, Le développement extraordinaire de Paris  et de sa Région ," Le développement extraordinaire de Paris  et de sa Région  n'était pas , dès l' origine , inscrit sur son sol : petite ville à la croisée de la route des Flandres et de la Seine , le Paris  romain ou gallo-romain n'était rien à côté de Narbonne , Lyon ou Toulouse . "
16,,,,,,," lentement ,","Avant de devenir au cours des 80 dernières années cette agglomération géante qui compte un nombre d' habitants équivalent à celui d' un petit pays européen , PARIS a grandi  lentement , guidé par des principes qui témoignent d' une rare continuité de pensée , d' une volonté de s'opposer au gigantisme , de la préoccupation de garder un équilibre harmonieux entre les différentes parties de la ville , du soin apporté à son embellissement et à son équipement . "
17,,,,,,, limiter la croissance de PARIS ,"L'un des plus constants soucis des Gouvernements successifs a été de  limiter la croissance de PARIS  afin de mieux assurer , selon les époques , la sécurité , la circulation , la police et ... la perception des impôts . "
18,,,,,,, bâtissant les enceintes successives de Paris .,"Philippe Auguste , Charles V , Louis XIII et les Fermiers Généraux ont , tour à tour , affirmé cette volonté en  bâtissant les enceintes successives de Paris . "
19,,,,,,, conserver un juste équilibre entre sa Capitale et ses villes de province .,"Henri II , au milieu du XVIe siècle , se montre soucieux déjà , de  conserver un juste équilibre entre sa Capitale et ses villes de province . "
20,,,,,,, conserver ou faire conserver ,"Dans le préambule d' un arrêt célèbre , il constate que , Parisétant Capitale et principale ville du royaume , il est nécessaire de  conserver ou faire conserver  en bon ordre et police , sans souffrir qu'il soit fait chose qui puisse amener désordre et confusion ,. "
21,,,,,,, se bastissent encores de nouveau ,"Il dénonce déjà l' exode des provinciaux vers la Capitale et ses faubourgs : , le grand nombre de maisons qui se sons basties depuis vingt ans et ça es fauxbourgs de ladite ville et  se bastissent encores de nouveau  chaque jour ( sont ) cause en premier lieu d' y attirer des autres villes et villages de nostre royaume une infinité de gens , lesquels trouvans esdits fauxbourgs aisée commodité de s'y loger , laissent et abandonnent lesdites villes et villages où ils estoient habituez ; "
22,,,,,,, s'y retirent et logent à la grande diminution des dites villes et à la surcharge des autres habitans nous payans tailles qui y demeurent ,"et pour jouir des franchises et exemptions dont jouissent les habitans des fauxbourgs de nostre dite ville  s'y retirent et logent à la grande diminution des dites villes et à la surcharge des autres habitans nous payans tailles qui y demeurent  ,. "
23,,,,un plan d' extension et d' embellissement où les considérations d' esthétique n'excluaient pas,,, de nombreux espaces libres pour bâtir ,"Quelques années plus tard , et bien que  de nombreux espaces libres pour bâtir  existent à l' intérieur de l' enceinte , Henri IV conçoitun plan d' extension et d' embellissement où les considérations d' esthétique n'excluaient pascelle de rentabilité du sol : le Roi prête cent mille francs pour élargir l' enceinte et permettre la création de nouveaux quartiers , tout de suite très recherchés , mais sous la condition qu'on lui rende deux cent mille francs quatre ans plus tard ! "
24,,,,,,, l' opération d' extension.,Sage façon de récupérer la plus-value donnée aux terrains par  l' opération d' extension. 
25,,,,dans l' Édit de 1607,,," faciliter la circulation , d' obliger les constructeurs à respecter l' alignement ","Il se préoccupe en même temps de  faciliter la circulation , d' obliger les constructeurs à respecter l' alignement  et définit ,dans l' Édit de 1607, les attributions du grand voyer et son concours en matière de voirie , police des rues et chemins. "
26,,,,,,, fixe ,"En 1638 , Louis XIII  fixe  un nouveau périmètre d' une longueur d' environ 16 km . "
27,,,,un plan,,," doit enclore les fauxbourgs Saint-Germain , Saint-Michel , Saint-Jacques , Saint-Marcel et Saint-Victor ","Un arrêt prévoit qu'un plansera établi dans ces nouvelles limites qui devront être matérialisées sur le sol par 31 bornes , à commencer depuis la rivière vis-à-vis le gros pavillon des Tuileries de ladite rivière en amont à regagner le bastion de l' Arsenal circuisant la ligne qui  doit enclore les fauxbourgs Saint-Germain , Saint-Michel , Saint-Jacques , Saint-Marcel et Saint-Victor  ,. "
29,,,,"un plan , exact et fidèle de PARIS sur lequel l' on marquerait les changements qui pourraient y être faits dans la suite pour la commodité publique , pour faciliter la communication des quartiers et pour  l' embellissement de cette ville </dyn",,,,"Colbert , assisté du Prévôt des Marchands Le Pelletier , fait établir par Bullet et Blondelun plan , exact et fidèle de PARIS sur lequel l' on marquerait les changements qui pourraient y être faits dans la suite pour la commodité publique , pour faciliter la communication des quartiers et pour  l' embellissement de cette ville > ,. "
30,,,,,,," l' accroissement continuel et de l' augmentation de , la grande ville ,","A cette époque on se plaint de  l' accroissement continuel et de l' augmentation de , la grande ville , provoqué par , la nécessité des affaires , le désir d' apprendre , le plaisir ou la curiosité ,. "
31,,,,,,," fut donc commencée ,","Une nouvelle enceinte  fut donc commencée , en même temps que des aménagements intérieurs contribuaient à l' embellissement et aux commodités de la ville : création de places , percements de rues , fontaines , monuments , aspects des berges de la Seine . "
32,,,,,,, a construit ,"Cinquante ans plus tard , une déclaration du ROI , en date du 18 juillet 1724 constate que l' on  a construit  à la périphérie , sans utiliser les possibilités que réservaient des terres encore en marais et même des terres labourables à l' intérieur des limites de 1672 , et estime , qu'au point de grandeur où cette ville est parvenue , on ne saurait y souffrir de nouvel accroissement sans l' exposer à sa ruine ,. "
33,,,,,,, interdiction de construire ,Un nouveau bornage est imposé avec  interdiction de construire  dans les faubourgs . 
34,,,,,,, le contrôle des nouvelles prescriptions .,"Le numérotage des maisons de Paris date de cette époque , et fut institué pour permettre  le contrôle des nouvelles prescriptions . "
35,,,,,,, l' extension des limites ,"En 1785 , les Fermiers Généraux pour remplir plus aisément les caisses du trésor royal proposent  l' extension des limites  à l' intérieur desquelles on percevait l' impôt . "
36,,,,,,, accroît ,"Ce nouveau périmètre , appelé à tort , enceinte , des Fermiers Généraux ,  accroît  à son tour la superficie de Paris et du même coup ses maux et désordres . "
37,,,,,,," En renonçant au pouvoir décentralisé des Intendants de l' ancien régime pour lui substituer un pouvoir central , soucieux des moindres détails de l' organisation départementale , Napoléon Ier fit de Parisla seule capitale politique et administrative ."," En renonçant au pouvoir décentralisé des Intendants de l' ancien régime pour lui substituer un pouvoir central , soucieux des moindres détails de l' organisation départementale , Napoléon Ier fit de Parisla seule capitale politique et administrative . "
38,,,,,,," la centralisation industrielle ,","Napoléon III y ajoutera  la centralisation industrielle , favorisée par le tracé des premières lignes de chemin de fer . "
39,,,,,,, bouleverse les vieux quartiers de Paris  ,"Haussmann , qui joint au souci de l' ordre public , le goût des perspectives et celui , particulier à son époque , du pastiche historique ( certains boulevards de Paris  ont été tracés , comme il l' indique lui-même , pour évoquer les perspectives de villes étrangères célèbres )  bouleverse les vieux quartiers de Paris   et les transforme en une ville moderne . "
41,,,,,,," est intégrée aux 12 arrondissements que comportait alors la Capitale , toutes les conditions se trouvent réunies pour susciter un développement considérable de l' agglomération parisienne .","Aussi , lorsqu'en 1859 , une partie des communes de banlieue  est intégrée aux 12 arrondissements que comportait alors la Capitale , toutes les conditions se trouvent réunies pour susciter un développement considérable de l' agglomération parisienne . "
42,,,,,,, s'accroîtra de 5 millions d' habitants .,"En moins de 80 ans , elle  s'accroîtra de 5 millions d' habitants . "
43,,,,,,," l' industrialisation ,","Le renouveau économique qui suivit la première guerre mondiale , lié au développement de  l' industrialisation , appelèrent à PARIS une population provinciale que le goût de la vie en plein air , le développement des moyens de transport et les mesures prises à cette époque pour faciliter l' accession à la propriété , conduisirent à s'installer dans des lotissements situés généralement le long des voies ferrées et des axes de circulation . "
44,,,,,,, réalisés ,"De qualité souvent douteuse ,  réalisés  au hasard des spéculations , ces lotissements ne tardèrent pas à occuper des surfaces égales à près d' une fois et demi celle de Paris( 13 . 000 hectares ). "
45,,,,,,, un développement aussi anarchique ,"C  '  est pour mettre un terme à  un développement aussi anarchique  qu  '  inesthétique et ruineux pour la collectivité , qu  '  un  obj>Comité   Supérieur de l  '   Aménagement et de  obj>l  '   Organisation Générale   de  obj> la Région   Parisienne , est créé au Ministère de l  '   intérieur en 1928 . "
46,,,,le schéma des <dyn,,,,"En l' installant , le ministre de l' intérieur , M . Albert Sarraut traçait la voie à suivre lorsqu'il déclarait : , Il ne lui servirait de rien de surveiller , de coordonner des activités , s'il n'intervenait aussi pour les orienter , pour tracer la route à suivre , établir avec le concours de techniciensle schéma des > grands travaux à effectuer , déterminer les zones réservées à l' habitation ou à tous autres usages , s'il ne servait de guide à ces collectivités trop isolées les unes des autres et qui ne peuvent que malaisément s'abstraire des intérêts dont elles ont la charge ,. "
47,,,,"une loi , complétée par un décret-loi du 25 juillet 1935 prévoit l' établissement du premier Plan d' Aménagement de la Région Paris",,,ienne ,"Le 14 mai 1932 ,une loi , complétée par un décret-loi du 25 juillet 1935 prévoit l' établissement du premier Plan d' Aménagement de la Région Parisienne . "
48,,,,Ce Plan,,, d' utilité publique ,Ce Plansera déclaré  d' utilité publique  à la veille de la guerre en 1939. 
49,,,,,,, d' avoir délimité des périmètres d' agglomération ,"L'un de ses nombreux mérites fut  d' avoir délimité des périmètres d' agglomération  afin d' assurer une meilleure utilisation du sol et d' avoir sauvegardé des espaces libres ou boisés , trop longtemps livrés à la cupidité des lotisseurs . "
50,,,,d' importants programmes de logements,,," La démolition des anciennes fortifications de la Capitale ,"," La démolition des anciennes fortifications de la Capitale , achevée en 1930 , et la constructiond' importants programmes de logements, tant sur cet emplacement que sur celui de l' ancienne , zone ,, ont définitivement effacé les traces de la dernière enceinte qui séparait encore la ville de sa banlieue. "
51,,,,,,, s'agrandit ;,Le problème de PARIS n'est plus dès lors celui d' une seule ville qui  s'agrandit ; 
52,,,,,,, s'étend sur 35 à 40 km de diamètre ,c'est le problème d' une vaste agglomération qui  s'étend sur 35 à 40 km de diamètre  et compte plus de 7 millions d' habitants . 
53,,,,,,," Agglomération géante au centre d' une région de plus de 100 km de diamètre ,"," Agglomération géante au centre d' une région de plus de 100 km de diamètre , où le caractère rural est le même que sur l' ensemble du territoire , mais où , à chaque instant , se marquent profondément le voisinage et l' attraction de PARIS . "
54,,,,,,, d' aménagement urbain ,"Cependant , aujourd'hui , aux problèmes  d' aménagement urbain  proprement dit s'ajoutent des problèmes d' aménagement du territoire où dominent les questions économiques et sociales , où l' équipement prend une place prépondérante et dont l' importance veut qu'y participent , non seulement PARIS et sa Région , mais la Francetout entière . "
55,,,,du nouveau plan d' aménagement et d' <lieu type,,, d' une politique d' aménagement de l' ensemble du territoire national ,"En plaçant dans le cadre  d' une politique d' aménagement de l' ensemble du territoire national  les étudesdu nouveau plan d' aménagement et d' =obj>organisation générale de la Région Paris ienne , dressé par ailleurs en étroite liaison avec le plan directeur d' urbanisme de PARIS , en hâtant leur conclusion , et en approuvant enfin le 6 août dernier ce nouveau plan , le Gouvernement du Général de Gaulle a marqué une nouvelle et importante étape dans l' Histoire de Paris et de sa Région. "
56,,,,,,, chasses impériales ,Carte dite des  chasses impériales  Levée et dressée de 1764 à 1773 préambule 
58,,,,,,, le quart en moyenne des richesses et des activités nationales .,"PARIS et sa Région groupent près du cinquième de la population française ,  le quart en moyenne des richesses et des activités nationales . "
59,,,,,,, du développement considérable de la population de la Région Parisienne ,"Les différentes fonctions de PARIS , capitale politique , administrative , culturelle , économique de la France sont à l' origine  du développement considérable de la population de la Région Parisienne  et du déséquilibre profond existant entre cette Région et le reste du territoire . "
60,,,,d' un plan national d' aménagement du territoire,,, Rétablir cet équilibre , Rétablir cet équilibre  est l' un des objectifsd' un plan national d' aménagement du territoire. 
61,,,,,,, L'organisation et l' aménagement de la Région Parisienne ," L'organisation et l' aménagement de la Région Parisienne  sont aussi , en raison de l' importance du problème parisien , des , affaires d' État , car elles intéressent la Nationtout entière . "
63,,,,,,,Les tâches multiples de construction et d' équipement ,"Les tâches multiples de construction et d' équipement  exigent , pour être conçues et réalisées dans l' ordre et l' harmonie , qu'une politique et une volonté d' aménagement et d' organisation soient affirmées et arrêtées. "
64,,,,le décret n° 58-1463 du 31 décembre 1958,,," ces tâches sont particulièrement lourdes et complexes ,","Dans la Région Parisienne où  ces tâches sont particulièrement lourdes et complexes ,le décret n° 58-1463 du 31 décembre 1958a prescrit que seraient établis : 1. "
65,,,,Un plan  d' aménagement et d' <lieu type,,, d' aménagement et d' =obj>organisation générale de la région parisienne ;,Un plan  d' aménagement et d' =obj>organisation générale de la région parisienne ; 2. 
66,,,,Des plans directeurs  d' urbanisme intercommunaux  portant chacun sur une fraction géographique de la région ;,,, d' urbanisme intercommunaux ,Des plans directeurs  d' urbanisme intercommunaux  portant chacun sur une fraction géographique de la région ;3. 
69,,,,,,," l' évolution démographique et économique prévue pour cette région , les principes généraux qui devront guider l' action des pouvoirs publics et servir de base à l' élaboration des plans directeurs d' urbanisme intercommunaux.","Le plan d' aménagement et d' organisation générale de la région parisienne définit , dans le cadre de  l' évolution démographique et économique prévue pour cette région , les principes généraux qui devront guider l' action des pouvoirs publics et servir de base à l' élaboration des plans directeurs d' urbanisme intercommunaux. "
71,,,,,,, une évolution du nombre des habitants et des possibilités d' emploi ,Les principales zones dans lesquelles doit être envisagée  une évolution du nombre des habitants et des possibilités d' emploi  et l' ordre de grandeur de cette évolution ; 2 . 
72,,,,,,, Les transformations à apporter ," Les transformations à apporter  en vue de satisfaire à cette évolution aux divers réseaux de communication , d' énergie , d' adduction d' eau et d' assainissement ; 3 . "
73,,,,,,, devront ,"Les zones où  devront  être concentrés , groupés ou créés les différents services publics ; 4 . "
74,,,,,,, Les zones à protéger , Les zones à protéger  au titre de l' agriculture ou des espaces verts . 
75,,,,,,, tant que de besoin ,Il précise en  tant que de besoin  : 1 . 
76,,,,,,, l' urbanisation ,Les secteurs dont  l' urbanisation  peut être poursuivie ou entreprise ; 2 . 
77,,,,,,, seront implantées les activités ,"Les secteurs où  seront implantées les activités  dont le maintien , l' extension ou la création seraient autorisés dans la région parisienne ; "
80,,,,,,, les parcs urbains à aménager ou à créer ,"Les zones qui devront faire l' objet de mesures de protection générale , ainsi que  les parcs urbains à aménager ou à créer  ; 5 . "
81,,,,,,, constructions .,"Les règles générales intéressant le mode d' occupation du sol et , éventuellement , les conditions générales d' implantation et de hauteur des  constructions . "
82,,,,,,, organisation ,"Ainsi est né le présent projet de Plan qui est essentiellement un document administratif de base , n'ayant nullement l' ambition de dessiner le PARIS de l' AN 2 . 000 , mais cherchant simplement à mieux poser certains problèmes , à affirmer une volonté d' aménagement et d' organisation  et à définir un cadre d' action pour les prochaines années . "
83,,,,,,, les options immédiatement nécessaires .,Il fait le point actuel des études et évoque  les options immédiatement nécessaires . 
85,,,,,,, les cinq cantons Sud du département de l' Oise .,"La Région Parisienne comprend les trois départements de la Seine , de Seine -et- Oise et de Seine-et-Marne , ainsi que  les cinq cantons Sud du département de l' Oise . "
87,,,,,,, 13 . 000 km² qui englobe la plus grande partie de l' Ile de France .,Elle couvre une superficie de  13 . 000 km² qui englobe la plus grande partie de l' Ile de France . 
88,,,,,,, n'a pas changé ,Sa situation administrative  n'a pas changé  depuis le début du XIXe siècle . 
89,,,,,,, Le Devenir de PARIS , Le Devenir de PARIS  nécessite des options importantes qui demandent des études approfondies . 
90,,,,,,," , Devenir de PARIS ,","Cependant , dans le monde terriblement mouvant qui est le nôtre , la définition d' une politique du  , Devenir de PARIS , impose que soient effectués certains choix de grande importance . "
91,,,,,,, des études approfondies menées avec des moyens scientifiques modernes .,"Or , de telles options ne sont possibles qu'après  des études approfondies menées avec des moyens scientifiques modernes . "
92,,,,,,, lieu type=obj>l' institut lieu> d' Aménagement et d' Urbanisme de lieu type=obj>la Régionlieu> Parisienne ,lieu type=obj>Ces études seront entrepriseslieu> par  lieu type=obj>l' institut lieu> d' Aménagement et d' Urbanisme de lieu type=obj>la Régionlieu> Parisienne  que le Gouvernement vient de créer . 
93,,,,,,, un avenir plus lointain .,"Lorsqu'elles seront achevées , elles autoriseront des prévisions plus ambitieuses en se projetant sur  un avenir plus lointain . "
94,,,,Le Plan d' Aménagement et d' Organisation Générale,,, d' une action coordonnée.,Le Plan d' Aménagement et d' Organisation Généralede la Région Parisienne doit constituer le cadre  d' une action coordonnée. 
95,,,,Le Plan <dyn,,,,"Le Plan > d' Aménagement et d' Organisation Générale de la Région Parisienne doit avoir le caractère d' un Plan Directeur qui — au terme de la procédure d' examen — engagera , tel qu'il sera en définitive arreté ( 1 ), tous les Ministères et les collectivités intéressés  dans une action coordonnée et précise. "
96,,,,,,," les réalisations nouvelles ,","Il constituera un cadre dans lequel devront se placer toutes  les réalisations nouvelles , tant en matière de construction que d' équipement , poursuivies par les Services Publics ou les particuliers . "
98,,,,Par décret pris sur le rapport des Ministres de la Construction,,," l' intérieur , des Finances et des Affaires Économiques , des Travaux Publics et des Transports.","Par décret pris sur le rapport des Ministres de la Construction, de  l' intérieur , des Finances et des Affaires Économiques , des Travaux Publics et des Transports. "
99,,,,Le Plan <dyn,,,,Le Plan > d' Aménagement et d' Organisation Générale de la Région Parisienne  doit tenir compte de certaines évolutions. 
100,,,,Le Plan <dyn,,,,"Le Plan > d' Aménagement et d' Organisation Générale de la Région Parisienne  doit tenir compte de la situation actuelle , mais aussi des prévisions que l' on peut faire , dans l' état actuel de nos connaissances , sur la population future de cette région et l' évolution des conditions de la vie moderne. "
103,,,,,,," d' exécution suffisante , assurer la coordination indispensable ","Il doit , tout en présentant des possibilités d' adaptation et une souplesse  d' exécution suffisante , assurer la coordination indispensable  dans les divers domaines , éviter les contradictions et la dispersion des efforts . "
105,,,,Le Plan <dyn,,,,"Le Plan > d' Aménagement et d' Organisation Générale de la Région Parisienne est destiné à remplacer le Projet d' Aménagement dressé conformément à la loi du 14 mai 1932 , pour une Région Parisienne limitée à l' époque à un périmètre tracé approximativement à 35 km autour de Notre-Dame et étendu vers le Nord à une partie du département de l' Oise. "
106,,,,par décret,,," les limites de la Région Parisienne , depuis le 28 août 1941 , englobent la totalité des départements de Seine-et-Oise et de Seine-et-Marne.","Ce projet , approuvépar décretle 22 juin 1939 , avait été mis en révision dès 1944 , cependant que  les limites de la Région Parisienne , depuis le 28 août 1941 , englobent la totalité des départements de Seine-et-Oise et de Seine-et-Marne. "
107,,,,,,, son extension ,"Les premières études de révision du projet de 1939 et de  son extension  aux nouvelles limites de la Région Parisienne , firent l' objet d' une prise en considération le 12 janvier 1956 par M . le Ministre de la Reconstruction et du Logement . "
