phrase_id,balise_lieu_obj,balise_lieu_loc,balise_act,balise_doc,balise_perc,balise_tps,balise_dyn,phrase
516,,,,,,," pourront y être installés ,","Les services publics principaux et notamment les établissements d' enseignement supérieur , secondaire ou technique qui  pourront y être installés , les centres d' affaires ou d' activités de toute nature et , en particulier , commerciales et industrielles , ainsi que les centres de culture et de loisirs qui pourront s'y créer et s'y développer , seront des pôles d' attraction pour les communes voisines d' autant plus importants et plus efficaces que les liaisons routières seront plus courtes- et plus aisées , que les moyens de transport en commun , routiers ou ferrés , seront conçus ou améliorés pour en faciliter l' accès . "
517,,,,,,," le nouveau noyau urbain ,","Les relations étant plus faciles avec  le nouveau noyau urbain , peut-être aussi moins longues et moins coûteuses , les habitants de ces communes seront incités à y venir plus fréquemment plutôt que de continuer à aller à PARIS et subir les inconvénients de la congestion parisienne . "
518,,,,,,, s'y développeront .,Ils y viendront d' autant plus aisément que les centres d' affaires et de travail  s'y développeront . 
519,,,,,,," un rayonnement d' autant plus grand que la , clientèle ,","Ceux-ci auront eux-mêmes  un rayonnement d' autant plus grand que la , clientèle , susceptible de les faire vivre au voisinage sera plus nombreuse . "
520,,,,,,," seront bien composés , correctement construits et équipés ,","On peut dire sans crainte de se tromper que dans la mesure où ces noyaux  seront bien composés , correctement construits et équipés , auront un caractère de grande ville et conserveront cependant des disponibilités suffisantes de terrains pour accueillir certains établissements de caractère un peu exceptionnel , ils étendront progressivement leur zone d' influence sur les communes voisines ; "
522,,,,,,, leurs emplacements soient particulièrement bien choisis ,"Mais il faut que  leurs emplacements soient particulièrement bien choisis  dans l' agglomération , sur de grands axes actuels ou projetés qui faciliteront les liaisons de ces différents noyaux entre eux et aussi avec la Capitale . "
523,,,,,,, les réaliser .,Il faut aussi qu'une action volontaire et continue soit menée pour  les réaliser . 
524,,,,dans le Plan,,, Les grandes opérations routières ou de transports ferrés , Les grandes opérations routières ou de transports ferrés  proposéesdans le Planet nécessaires en tout état de cause pour l' aménagement de la Région pourront être l' un des facteurs déterminant pour leur réussite. 
525,,,,,,, Zone d' économie urbaine ,PARIS ET SA RÉGION Paris Limite du département de la Seine Limite de la Région Parisienne  Zone d' économie urbaine  
526,,,,,,, UN AMÉNAGEMENT RÉGIONAL ,Les villes périphériqueschapitre troisième PROPOSITIONS POUR  UN AMÉNAGEMENT RÉGIONAL  I-LE SCHÉMA GÉNÉRAL 
527,,,,,,, d' Aménagement et d' Organisation Générale de la Région Parisienne.,"Le schéma général est en fonction des considérations exposées dans les chapitres précédents , qu'ont été élaborées les présentes propositions pour un Plan  d' Aménagement et d' Organisation Générale de la Région Parisienne. "
532,,,,,,, réorganiser et de restructurer la banlieue ,Le problème essentiel est celui de  réorganiser et de restructurer la banlieue  et non de l' étendre . 
533,,,,,,, des disponibilités suffisantes en terrains bien situés dans son sein ou dans ses franges immédiates ,"Si une telle solution est possible dans l' agglomération parisienne , si  des disponibilités suffisantes en terrains bien situés dans son sein ou dans ses franges immédiates  existent , c'est incontestablement celle qui serait la plus profitable aux 7 . 000 . 000 d' habitants qui la constituent . "
534,,,,,,," nouveaux noyaux urbains principaux et secondaires ,","Or , un examen critique des localisations possibles de  nouveaux noyaux urbains principaux et secondaires , montre que cette solution peut être envisagée . "
536,,,,,,, Chaque noyau ou centre urbain principal ," Chaque noyau ou centre urbain principal  devrait comporter une zone très urbanisée et équipée d' un ensemble polyvalent de services publics et privés , de qualité supérieure ou exceptionnelle comme n'en possèdent guère que les villes de plusieurs centaines de milliers d' habitants . "
537,,,,,,, réalisés ,Ils devraient être convenablement répartis autour de PARIS et pouvoir être  réalisés  successivement dans le temps . 
538,,,,,,," contrebalançant partiellement celle de PARIS  , ils ne peuvent être très nombreux et , par ailleurs , les habitants de leur zone d' influence ne doivent pas traverser PARIS  pour les rejoindre .","Si l' on veut qu'ils aient un poids ou une attraction locale  contrebalançant partiellement celle de PARIS  , ils ne peuvent être très nombreux et , par ailleurs , les habitants de leur zone d' influence ne doivent pas traverser PARIS  pour les rejoindre . "
540,,,,,,, s'étendant ,"La configuration actuelle de la banlieue parisienne ,  s'étendant  dans toutes les directions autour de PARIS , appellera nécessairement plusieurs localisations . "
541,,,,,,, pourront s'y placer ,"Les éléments qui  pourront s'y placer  se révéleront peu à peu : il faut pour que l' un de ces centres puisse réellement , démarrer , qu'il possède déjà quelques-uns de ces éléments autour desquels d' autres viendront facilement s'installer . "
542,,,,,,, ne peut penser réaliser à la fois toutes ces intentions ,On  ne peut penser réaliser à la fois toutes ces intentions  ; 
543,,,,,,, toutes réalisations de cette importance ,"mais on peut par contre les prévoir , les étudier , les préparer et surtout prendre à temps les décisions préalables à  toutes réalisations de cette importance  qui s'échelonneront suivant une période plus ou moins longue . "
544,,,,,,, une restructuration de l' agglomération ,"La localisation des divers , noyaux , qui pourraient permettre  une restructuration de l' agglomération  est à l' étude . "
545,,,,,,, d' être étudiés .,"Dès maintenant , les centres ci-après sont envisagés ou méritent  d' être étudiés . "
546,,,,,,, son prolongement éventuel ,A - LA DÉFENSE et  son prolongement éventuel  vers la forêt de SAINT GERMAIN dans la plaine de MONTESSON . 
547,,,,,,, l' opération ,"Envisagée il y a trois siècles comme une route pour rejoindre les chasses de SAINT-GERMAIN , ponctuée au siècle dernier par le , monument de la DÉFENSE ,,  l' opération  dite , de la DÉFENSE , fut l' objet de multiples propositions , concours , projets , visant à marquer une volonté de prolonger vers l' Ouest le grand axe de PARIS: Louvre , Concorde , Étoile( 1 ). "
548,,,,,,, une réalisation ,"Aujourd'hui , l' accord s'est fait sur  une réalisation  qui marque un premier prolongement vers l' extérieur de PARIS du mouvement vers l' Ouest du quartier des affaires , mouvement qui a atteint l' avenue de la Grande-Armée et se dessine à NEUILLY . "
549,,,,,,, son développement est presque purement linéaire ,"Mais alors que  son développement est presque purement linéaire  jusqu'à présent , il connaîtrait dans le quartier de la DÉFENSE une intensité et un étalement très importants . "
550,,,,,,, la construction du Centre National des Industries et des Techniques ,L'entreprise hardie qu'a été  la construction du Centre National des Industries et des Techniques  a vaincu bien des hésitations et des réticences . 
551,,,,,,," l' opération d' ensemble ,","S'il est encore trop tôt pour juger de  l' opération d' ensemble , il faut noter cependant que les demandeurs de terrains s'y pressent . "
552,,,,,,," projettent leurs buildings ,","De grandes Sociétés y  projettent leurs buildings , la Foire de PARIS s'y tiendra sans doute un jour , d' autres animateurs pensent à y construire un Palais des Congrès , un Théâtre populaire , un grand hôtel , un nouveau , Vélodrome d' Hiver,. "
553,,,,,,," le commencement des travaux de construction du prolongement du métropolitain ,","Ce mouvement s'accélérera sûrement , maintenant que le Gouvernement vient de décider  le commencement des travaux de construction du prolongement du métropolitain , amorçant ainsi la réalisation d' une transversale rapide Est-Ouest de PARIS . "
554,,,,,,, 700 hectares de la banlieue Nord-Ouest de PARIS dans la première boucle de la Seine ;,La Région de la DÉFENSE intéresse  700 hectares de la banlieue Nord-Ouest de PARIS dans la première boucle de la Seine ; 
555,,,,,,, sont disponibles ou récupérables .,au-delà de cette zone et dans la deuxième boucle formée par la Seine— de l' Ile de Chatou à la Forêt de Saint-Germain— près de 1 . 000 hectares  sont disponibles ou récupérables . 
556,,,,,,," l' opération , DÉFENSE ,","Par leur situation , ils peuvent permettre le prolongement éventuel de  l' opération , DÉFENSE , et se prêter magnifiquement à des installations aérées complétant les précédentes . "
557,,,,,,, sa réussite .,Sa situation privilégiée dans le prolongement du grand axe de PARIS permet de bien augurer de  sa réussite . 
558,,,,,,," d' un centre d' affaires et de lieux de grandes manifestations de tous ordres ,","Son caractère sera sûrement celui  d' un centre d' affaires et de lieux de grandes manifestations de tous ordres , en même temps qu'un centre d' attraction important pour une grande partie de la population de la banlieue immédiate Ouest-Nord-Ouest de Paris . "
560,,,,,,, l' aménagement de la voie ,Un concours avait été ouvert et jugé en 1931 pour  l' aménagement de la voie  allant de la place de l' Étoile au Rond-Point de la Défense . 
562,,,,,,, recevoir un nouveau noyau urbain important ,"Lorsqu'on envisage les différents emplacements susceptibles de  recevoir un nouveau noyau urbain important  dans l' agglomération parisienne , on ne peut s'empêcher de penser à l' utilisation possible , dans ce but , du Plateau de VILLACOUBLAY . "
563,,,,,,, la réalisation d' un ensemble ,"Ceinturé par les bois de VERRIÈRES , de CLAMART , de MEUDON et de l 'Homme Mort , d' où il émerge , le Plateau de VÉLIZY-VILLACOUBLAY , de 700 hectares environ de superficie , par sa situation à l' abri de toute pollution atmosphérique provenant de l' agglomération parisienne , particulièrement sain et aéré , se présente avec des caractéristiques correspondant aux principaux critères énumérés au Chapitre 2 , et il serait susceptible de permettre  la réalisation d' un ensemble  particulièrement intéressant , jumelé avec l' agglomération Versaillaise , si l' aérodrome militaire , qui en occupe environ la moitié , pouvait être transféré ailleurs . "
564,,,,,,, agrandissement ,"Or , certains techniciens de l' aéronautique affirment que cet aérodrome , dont l' utilisation par des appareils militaires à réaction avait soulevé des protestations de la part des populations des Cités-jardins de CHATENAY-MALABRY et du PLESSIS-ROBINSON , n'est pas sans apporter une gêne à la navigation aérienne , gêne susceptible de devenir d' autant plus sensible que le trafic aérien de l' aérodrome d' ORLY( en cours d' agrandissement  ) doit augmenter très sensiblement dans les prochaines années . "
565,,,,,,," l' aménagement de la Région Parisienne ,","De sorte que , du point de vue de  l' aménagement de la Région Parisienne , on peut se demander si un transfert de ces installations aéronautiques ne risque pas d' être envisagé dans l' avenir . "
566,,,,,,, d' une utilisation du Plateau de Villacoublay ,"Aussi bien dans une telle hypothèse , l' étude  d' une utilisation du Plateau de Villacoublay  mérite-t-elle d' être entreprise ? "
568,,,,,,, la construction d' un noyau important ,On pourrait prévoir  la construction d' un noyau important  avec des activités secondaires et tertiaires en nombre suffisant pour améliorer l' équilibre économique et social des communes environnantes . 
569,,,,,,, la construction d' une ville universitaire ou d' une cité administrative .,On peut envisager aussi  la construction d' une ville universitaire ou d' une cité administrative . 
570,,,,,,, la construction d' une ville-parc ,L'hypothèse de  la construction d' une ville-parc  spécialement aménagée pour les sports et les loisirs présente également un certain intérêt . 
571,,,,,,," La proximité de VERSAILLES , de la Faculté d' ORSAY et des Centres de recherches du Plateau de SACLAY et de la Vallée de Chevreuse ;"," La proximité de VERSAILLES , de la Faculté d' ORSAY et des Centres de recherches du Plateau de SACLAY et de la Vallée de Chevreuse ; "
572,,,,,,, d' aménager ,"les liaisons ferrées existantes à proximité avec la rive gauche de PARIS , et qu'il serait nécessaire  d' aménager  et derapprocher ; "
573,,,,,,, devant être améliorée ,une ossature routière  devant être améliorée  dans ses liaisons avec PARIS et notamment les quais de la rive gauche ; 
574,,,,,,, cette nouvelle utilisation ,la beauté des sites environnants donneraient à  cette nouvelle utilisation  une chance certaine de réussite . 
575,,,,,,," La région Nord-Nord-Est de la banlieue ( STAINS , SAINT-DENIS , PIERREFITTE , SARCELLES , GARGES-les-GONESSE , LE BOURGET ,","C -  La région Nord-Nord-Est de la banlieue ( STAINS , SAINT-DENIS , PIERREFITTE , SARCELLES , GARGES-les-GONESSE , LE BOURGET , etc .). "
577,,,,,,, grignotée sans cesse ,"Appuyé au Nord-Ouest sur la forêt de MONTMORENCY et au Nord-Est sur les restes de la forêt de BONDY  grignotée sans cesse  par des lotissements ou des exploitations de carrières , cet ensemble groupe une population de l' ordre de 800 . 000 habitants . "
578,,,,,,, le développement ,"A l' exception de quelques communes , ENGHIEN , MONTMORENCY , etc . vers le Nord-Ouest , cette région est l' une de celles dont  le développement  s'est poursuivi de façon anarchique et où les conditions de vie mériteraient particulièrement d' être améliorées . "
579,,,,,,," l' essentiel de son emploi dans le vaste secteur industriel situé de GENNEVILLIERS à PANTIN , en passant par SAINT-DENIS , AUBERVILLIERS , LA COURNEUVE ,","La majorité de la population active , 300 . 000 travailleurs , trouve  l' essentiel de son emploi dans le vaste secteur industriel situé de GENNEVILLIERS à PANTIN , en passant par SAINT-DENIS , AUBERVILLIERS , LA COURNEUVE , etc… "
580,,,,,,," d' améliorer cette situation ,","Des initiatives ont déjà été prises pour tenter  d' améliorer cette situation , tant par les communes que par un certain nombre de grands constructeurs à SAINT-DENIS , à SARCELLES , à GARGES-LES-GONESSE , à LA COURNEUVE . "
581,,,,,,, d' y créer un vaste parc départemental ,"Depuis de nombreuses années , le département de la Seine a envisagé  d' y créer un vaste parc départemental  à LA COURNEUVE et a acquis dans ce but plusieurs centaines d' hectares . "
582,,,,,,," ces heureuses réserves de terrains ,","Presque au milieu de cette zone , et à proximité de  ces heureuses réserves de terrains , l' aérodrome du BOURGET et ces terrains immédiatement limitrophes constituent un vide d' environ 1 . 000 hectares . "
583,,,,,,, a conduit à neutraliser plusieurs centaines d' hectares ,"La gêne qu'il occasionne déjà aux populations voisines et qui  a conduit à neutraliser plusieurs centaines d' hectares  situés à sa proximité immédiate au Sud-Ouest , n'ira qu'en s'accentuant si son développement envisagé pour faire face aux besoins aéronautiques était autorisé . "
584,,,,,,," un projet d' extension et de développement de cet aéroport ,","A la suite d' entretiens avec les Services du Ministère de la Construction et du Ministère des Travaux Publics et des Transports , consécutifs à  un projet d' extension et de développement de cet aéroport , une étude a été demandée à la Direction Générale de l' Aéroport de PARIS , pour savoir dans quelles conditions un éventuel transfert de l' aérodrome du BOURGET pourrait être envisagé , de préférence à l' extension et à la modernisation sur place de l' aérodrome actuel . "
585,,,,,,, pouvait être aménagé ,"Cette étude préliminaire a conclu qu'en raison des besoins propres à l' aéronautique et notamment du développement de l' aviation supersonique , une telle hypothèse pouvait être envisagée si un aéroport Nord de PARIS , appelé à remplacer celui du BOURGET ,  pouvait être aménagé  en dehors et à proximité de l' agglomération . "
586,,,,,,," la localisation dans cette région d' un nouveau centre urbain relativement important ,","Dès lors , l' hypothèse de  la localisation dans cette région d' un nouveau centre urbain relativement important , ceinturant le futur Parc de La Courneuve , bien desservi par l' autoroute du Nord et des liaisons ferrées existantes ou pouvant être améliorées , profondément encastré dans la banlieue , pourrait être envisagée comme un élément restructurateur de tout l' ensemble indiqué précédemment . "
587,,,,,,, cette localisation ,"Combinant , dans une vue d' avenir à long terme , les besoins d' une population existante très importante et les besoins d' avenir de l' aéronautique ,  cette localisation  serait particulièrement heureuse dans cette banlieue . "
588,,,,,,, important .,"Les nouveaux ensembles d' habitations de SARCELLES , de SAINT-DENIS , de GARGES-LES-GONESSE Dame-Blanche , de LA COURNEUVE , formeraient une couronne autour d' un pôle d' attraction appelé à devenir très  important . "
591,,,,,,, restructuration ,"Si les trois noyaux de  restructuration  évoqués ci-dessus se sont imposés pour l' un ( la Défense) et méritent d' être étudiés ( pour les deux autres ), la recherche d' un ou plusieurs centres dans la région Est et Sud-Est présente plus de difficultés . "
592,,,,,,," L'occupation actuelle de cette banlieue ,"," L'occupation actuelle de cette banlieue , son relief assez accentué au voisinage de PARIS et de la vallée de la Marne , les dessertes routière et ferroviaire peu commodes , rendent un choix difficile parmi des solutions discutables . "
593,,,,,,," la poussée vers l' Ouest de l' agglomération parisienne ,","Il est cependant indispensable , si l' on ne veut pas encourager démesurément  la poussée vers l' Ouest de l' agglomération parisienne , de prévoir dans cette région de la banlieue , elle aussi très peuplée , au moins un centre restructurateur , non seulement pour des raisons d' équilibre mais aussi d' organisation rationnelle des besoins futurs des transports en commun . "
594,,,,,,, l' opération décidée du grand ensemble de CRÉTEIL ,"Si l' on peut admettre que  l' opération décidée du grand ensemble de CRÉTEIL  répond à l' idée d' une organisation de la partie de banlieue comprise entre la Seine et la boucle de SAINT-MAUR de la Marne , on est tenté de reporter les efforts dans la région Est , au voisinage de l' autoroute de l'Est , à l' intérieur de la ceinture boisée existante de l' agglomération parisienne et en liaison étroite avec les deux voies ferrées principales desservant cette région : la ligne de Vincennes et la ligne de Gretz . "
596,,,,dans le Plan,,, l' utilisation de grands domaines boisés ,"On devra se méfier cependant de toute solution de facilité qui pourrait consister à prévoir  l' utilisation de grands domaines boisés  relativement proches des limites actuelles de l' agglomération , et dont la sauvegarde au même titre que tous les ensembles boisés ceinturant celle-ci est prévuedans le Pland' Aménagement. "
597,,,,,,, la création d' un nouveau noyau ,"En tout état de cause ,  la création d' un nouveau noyau  à proximité des limites de l' agglomération , mais en dehors de celle-ci , aurait comme conséquence inévitable un prolongement tentaculaire de l' agglomération vers ce noyau sans pour autant amener vers lui les populations de banlieue qui continueraient à être attirées par la Capitale . "
599,,,,,,, la restructuration de la banlieue ,"Une première étape dans  la restructuration de la banlieue  est amorcée avec les , grands ensembles ,, rendus possibles par une politique foncière appuyée sur le Fonds National d' Aménagement du Territoire , mais engagée bien tardivement , et par le progrès de la technique de la construction qui a permis de faire passer la dimension des chantiers en 10 ans de 100 logements à plusieurs milliers . "
600,,,,,,, les constructions nouvelles .,"Partant de la constatation que , dans toute l' agglomération , les équipements publics sont insuffisants , il est apparu indispensable de ne pas accroître cette insuffisance par  les constructions nouvelles . "
601,,,,,,, certains ensembles réalisés ,"Au cours des dernières années , dans  certains ensembles réalisés  par quelques grands organismes constructeurs , le financement des équipements collectifs a parfois été retardé par suite de la difficulté de coordonner les diverses sources de financement . "
602,,,,,,," conjuguant en règle générale zone d' habitation et zone d' activités ,","La politique nouvelle des grands ensembles a précisément pour objet de promouvoir des unités qui doivent être convenablement équipées , socialement équilibrées et économiquement cohérentes , comprenant , à côté des logements , non seulement des écoles , mais également tous les services publics , les équipements sociaux , commerciaux , culturels et autres , et  conjuguant en règle générale zone d' habitation et zone d' activités , conformément à la politique de rapprochement de l' habitat et du travail . "
603,,,,,,, permettront ,"De plus , ces grands ensembles  permettront  de localiser dans leur périmètre certains équipements publics nécessaires non seulement aux populations nouvelles , mais à celles vivant déjà dans les quartiers proches ou les communes voisines . "
604,,,,,,, ces grands ensembles ,"Les conditions d' existence et de fonctionnement de  ces grands ensembles  ont fait l' objet d' études approfondies de la , Commission de la vie dans les grands ensembles , créée au début de 1958 par le Commissaire à la Construction et à l' Urbanisme , et dont les 5 groupes de travail ont abouti à des conclusions publiées au début de 1959 . "
605,,,,,,, être implantés ,"Destinés à  être implantés  dans le tissu urbain de la banlieue , là où leur réalisation ne doit pas poser de trop gros problèmes préalables d' équipement et de desserte en moyens de transports publics , ils constitueront un premier pas , non négligeable , bien qu'à une échelle sans doute moins importante que les noyaux précédemment évoqués , vers une restructuration et une régénération de la banlieue , complétant l' effort de rénovation entrepris dans PARIS et dans d' autres secteurs de banlieue . "
606,,,,,,, la réalisation ,Les grands ensembles dont  la réalisation  est décidée sont au nombre de 9 ; 
607,,,,,,, sont situés ,ils  sont situés  relativement près de PARIS à : • MASSY 
609,,,,,,," FONTENAY-SOUS-BOIS ,","- MAISONS-ALFORT , • VITRY , • STAINS - SAINT-DENIS - PIERREFITTE , • ARGENTEUIL , •  FONTENAY-SOUS-BOIS , • AULNAY-SOUS-BOIS - SEVRAN-TREMBLAY- LES-GONESSE , • BURES-ORSAY ; "
610,,,,,,, une possibilité de construction de quelque 85 . 000 logements et 200 hectares de zones d' activités .,ils représentent  une possibilité de construction de quelque 85 . 000 logements et 200 hectares de zones d' activités . 
611,,,,,,, Ces opérations entreprises ," Ces opérations entreprises  sur l' initiative du Commissaire à la Construction et à l' Urbanisme pour la Région Parisienne feront suite à celles exécutées avec son accord par de grands constructeurs à SARCELLES , GARGES-LES-GONESSE , ÉPINAY-SUR-SEINE , LA COURNEUVE , etc ., et un grand nombre d' autres opérations importantes dispersées dans toute la banlieue . "
612,,,,,,, de telles opérations ,"Sans doute , peut-on dire que  de telles opérations  contribueront à , colmater , les derniers vides de l' agglomération . "
613,,,,,,, d' une ,"Sans doute aussi , peut-on regretter que les circonstances n'aient pas permis et ne permettent pas encore de se contenter  d' une  politique de reconquête des anciens quartiers ou centres urbains vétustes ou insalubres de PARIS ou des communes de banlieue . "
614,,,,,,, rénovation ,Mais l' importance des besoins et les difficultés d' une politique de  rénovation  ont rendu nécessaire dans la conjoncture actuelle cette étape des centres secondaires ou grands ensembles . 
615,,,,,,, la création de centres urbains principaux ,"Elle devrait céder la place le plus rapidement possible à  la création de centres urbains principaux  qui seraient plus efficaces pour une réorganisation à grande échelle de la Région Parisienne , cette politique étant menée de pair avec celle de rénovation urbaine qui devrait non seulement être poursuivie , mais largement intensifiée . "
617,,,,,,," remise en ordre ,","Les dispositions préconisées pour la Région Parisienne sont le double reflet d' une même volonté de  remise en ordre , qu'il s'agisse de PARIS ou de sa banlieue. "
618,,,,Plan,,,PlanDirecteur d' Urbanisme de la Capitale ,"Elles résultent : pour partie , des propres impératifs parisiens tels qu'ils ont été définis dans le Projet de PlanDirecteur d' Urbanisme de la Capitale  ; "
619,,,,,,, ses insuffisances ;,"pour partie , d' impératifs tenant à la situation actuelle de la banlieue et à  ses insuffisances ; "
