phrase_id,balise_lieu_obj,balise_lieu_loc,balise_act,balise_doc,balise_perc,balise_tps,balise_dyn,phrase
1737,,,,,,, l' exploitation ,"Afin d' en permettre une étude un peu plus précise , toutes ces activités seront groupées en trois catégories principales habituellement utilisées : ACTIVITÉS PRIMAIRES : celles ayant trait à  l' exploitation  des ressources naturelles du sol ( agriculture , bois , forêts ) et du sous-sol ( industries extractives ) ; "
1739,,,,,,," ACTIVITÉS TERTIAIRES : tout ce qui touche au commerce et aux affaires , aux transports , aux administrations , etc ."," ACTIVITÉS TERTIAIRES : tout ce qui touche au commerce et aux affaires , aux transports , aux administrations , etc . "
1741,,,,,,, sont exercées certaines activités collectives ,"Le recensement établi par l' I . N . S . E . E . en 1954 concernant les établissements dans lesquels  sont exercées certaines activités collectives  ( 1 ) indique que : — 394 . 885 de ces établissements sont répartis sur les trois départements de Seine , Seine-et-Oise et Seine-et-Marne ; "
1743,,,,,,," l' exclusion des activités agricoles , des activités administratives et des professions libérales .","Les tableaux statistiques de l' I . N . S . E . E . ont été limités aux seuls établissements à caractère industriel et commercial à  l' exclusion des activités agricoles , des activités administratives et des professions libérales . "
1745,,,,,,, 2 . 056 . 563 établissements .,Ces chiffres sont à rapprocher de l' estimation correspondant à l' ensemble de la France métropolitaine:  2 . 056 . 563 établissements . 
1746,,,,,,, ces établissements ,Les salariés employés dans  ces établissements  se dénombrent comme suit : RÉGION PARISIENNE: — pour les trois départements visés ci-dessus — pour la seule agglomération de Paris EN FRANCE MÉTROPOLITAINE 1 . 946 . 667 salariés 1 . 693 . 504 salariés 7 . 639 . 083 salariés ( 2 ) 
1747,,,,,,, l' ensemble du territoire ,La comparaison des chiffres souligne l‘importance des activités de la Région Parisienne et de leurs salariés par rapport à  l' ensemble du territoire  ( 3 ). 
1750,,,,,,," l' ensemble du problème ,","Afin d' embrasser  l' ensemble du problème , ce sont les estimations de la population active qui ont été retenues et qui ont servi de base aux calculs qui vont suivre . "
1753,,,,,,," l' agglomération parisienne ,","elle est moins importante que  l' agglomération parisienne , telle qu'elle résulte des études d' aménagement . "
1754,,,,,,, Les prochaines statistiques seront faites sur des limites arrêtées en commun avec l' I . N . S . E . E . , Les prochaines statistiques seront faites sur des limites arrêtées en commun avec l' I . N . S . E . E .  ( 2 ) 
1758,,,,,,," établissements industriels , artisanaux et commerciaux ","Le dépouillement fait par l' I . N . S . E . E . en 1958 des  établissements industriels , artisanaux et commerciaux  auquel il sera fait allusion plus loin ne donne pas de renseignements en ce qui concerne le nombre de salariés . "
1760,,,,,,, les différentes activités de la Région Parisienne ,"La répartition approximative des travailleurs employés en 1954 dans  les différentes activités de la Région Parisienne  était la suivante ( voir tableau de la page 7 ) : primaires : 91 . 500 travailleurs , soit environ 2 , 5 % secondaires : 1 . 555 . 500 travailleurs , soit environ 43 , 5% tertiaires : 1 . 918 . 000 travailleurs , soit environ 54 % Total 3 . 565 . 000 travailleurs , sur 7 . 305 . 000 , soit près de 49 % ( 1 ). "
1761,,,,,,," agglomérations françaises de plus de 80 . 000 habitants ,","Il est intéressant de rapprocher ces pourcentages de ceux des  agglomérations françaises de plus de 80 . 000 habitants , qui sont respectivement de : 1 % ; 40 , 6 % ; 5 8 , 4 % et qui sont dans l' ensemble comparables . "
1762,,,,,,," l' on entre plus dans le détail ,","Mais si  l' on entre plus dans le détail , on s'aperçoit que pour PARIS seul , ces pourcentages sont respectivement de : 0 , 13 %; "
1764,,,,,,, la concentration massive des activités tertiaires ,"62 , 27 % c'est dire  la concentration massive des activités tertiaires  dans la Capitale où elles occupent près d' un million de personnes dont la moitié correspond à une main-d' œuvre féminine . "
1766,,,,,,," 18 . 870 . 000 travailleurs , sur 42 . 830 . 000 , soit 44 %.","Pour la France en 1954 , cette répartition était la suivante : — Primaire S . 200 . 000 travailleurs — Secondaire 6 . 630 . 000 travailleurs — Tertiaire 7 . 040 . 000 travailleurs soit  18 . 870 . 000 travailleurs , sur 42 . 830 . 000 , soit 44 %. "
1768,,,,,,, la dispersion de l' habitat dans la périphérie de l' agglomération ,"Si l' on reporte sur une carte les seuls établissements de plus de 50 salariés de toute nature ( secondaire en rouge , tertiaire en bleu et noir ) de l' agglomération parisienne , pour essayer d' avoir une vue d' ensemble de leurs localisations , on s'aperçoit encore bien davantage du contraste que présente la concentration des activités tertiaires dans le centre de PARIS   et la relative dispersion dans PARIS   même et en couronne autour de PARIS   des activités secondaires , cependant qu'à  la dispersion de l' habitat dans la périphérie de l' agglomération  correspond une absence quasi-totale , à quelques exceptions près , d' activités importantes de quelque nature que ce soit . "
1770,,,,,,," les activités primaire , secondaire et tertiaire à PARIS et dans les départements de la Région Parisienne ","Nombre et pourcentage de salariés employés dans  les activités primaire , secondaire et tertiaire à PARIS et dans les départements de la Région Parisienne  ( l ). "
1772,,,,,,, l' agglomération parisienne .,Permet une comparaison graphique du DANS nombre d' emplois dans les différents arrondissements* de PARIS et les communes de  l' agglomération parisienne . 
1773,,,,,,," la concentration et la congestion parisiennes , l' importance des migrations journalières des travailleurs et les pointes auxquels les moyens de transport en commun ont à faire face matin et soir , et aussi le manque de vie et d' âme des cités-dortoirs de la périphérie .","Tout cela explique à la fois ,  la concentration et la congestion parisiennes , l' importance des migrations journalières des travailleurs et les pointes auxquels les moyens de transport en commun ont à faire face matin et soir , et aussi le manque de vie et d' âme des cités-dortoirs de la périphérie . "
1775,,,,,,," les établissements industriels , artisanaux et commerciaux ","L'I . N . S . E . E . vient de publier une étude sur  les établissements industriels , artisanaux et commerciaux  en France en 1958 . "
1776,,,,,,, l' atlas industriel de la France ,"De cette étude qui ne comporte malheureusement pas de renseignements en ce qui concerne l' évolution du nombre des salariés et ne se rapporte qu'à certaines catégories d' établissements , ainsi que de  l' atlas industriel de la France  réalisé d' après le recensement de la population de 1954 , on peut tirer quelques indications générales ( 1 ). 1 . "
1777,,,,,,," une diminution de l' ordre de 2 % environ , celui de la Région Parisienne a présenté pendant la même période une tendance générale à l' augmentation .","Le nombre total d' établissements en France a marqué entre 1954 et 1958  une diminution de l' ordre de 2 % environ , celui de la Région Parisienne a présenté pendant la même période une tendance générale à l' augmentation . "
1779,,,,,,, une diminution ,"A PARIS même ,  une diminution  s'amorce dans le nombre des établissements , tant industriels que commerciaux . 3 . "
1780,,,,,,, un développement non négligeable de ce nombre ,"Par contre ,  un développement non négligeable de ce nombre  ( près de 8 . 000 dont 2 . 000 commerciaux ) sur un total de 400 . 000 environ , soit 2 % est enregistré dans la banlieue et notamment dans le département de la Seine et la couronne périphérique du département de Seine-et-Oise . "
1781,,,,,,, l' augmentation du potentiel industriel de la Région Parisienne ,Ce développement est d' autant plus à souligner que le Gouvernement a poursuivi activement la politique engagée dès 1948 qui avait pour but de lutter contre  l' augmentation du potentiel industriel de la Région Parisienne  et de réaliser une décentralisation vers la province d' un certain nombre d' établissements industriels parisiens . 
1783,,,,,,, les établissements à caractère industriel et commercial ,"Comme pour l' étude publiée en 1954 à laquelle on s'est référé à la page 2 , l' I . N . S . E . E . a limité la publication de ses statistiques à celles qui concernent  les établissements à caractère industriel et commercial  à l' exclusion des activités agricoles , des activités administratives et des professions libérales . "
1784,,,,,,, un accroissement de superficie de planchers ,"Le contrôle des permis de construire instauré depuis 1954 des bâtiments à usage industriel de plus de 500 m2 de superficie accuse de son côté  un accroissement de superficie de planchers  dans la Région Parisienne de 2 . 600 . 000 m2 pour un total pour la France entière de 10 . 400 . 000 m2 , soit 25% ( 1 ) pour les 5 années de 1954 à 1958 inclus . "
1785,,,,,,, ont fait l' objet de permis de construire ,"Pour l' année 1959 , 438 . 000 m2  ont fait l' objet de permis de construire  dans la Région Parisienne , sur un total de 2 . 460 . 000 m2 . "
1787,,,,,,,"( desserrement , modernisation , adaptation aux progrès de l' automation , confort ), d' augmentation des capacités de stockage ,","A défaut de statistiques précises , on peut l' estimer , compte tenu des nécessités d' amélioration des conditions de travail ( desserrement , modernisation , adaptation aux progrès de l' automation , confort ), d' augmentation des capacités de stockage , de destruction aussi de bâtiments industriels vétustes , à 130 . 000 emplois nouveaux environ . "
1788,,,,,,," d' après des estimations résultant de diverses sources provenant d' enquêtes du Ministère du Travail , il semble que la population active de la Région Parisienne ","D'autre part ,  d' après des estimations résultant de diverses sources provenant d' enquêtes du Ministère du Travail , il semble que la population active de la Région Parisienne  ait augmenté au total de 1954 à 1960 d' environ 280 . 000 salariés . "
1789,,,,,,," des activités secondaires et ceux qui , en majorité , ont des activités tertiaires .","Dans ce chiffre , il convient bien entendu de faire la part entre ceux occupés par  des activités secondaires et ceux qui , en majorité , ont des activités tertiaires . "
1790,,,,,,, 675 opérations de décentralisation ,"Et pourtant , pendant la période du 1er Octobre 1950 au 1er Juin 1960 ,  675 opérations de décentralisation  ont été décidées dont la réalisation correspond à la création en province de 155 . 000 emplois ! "
1791,,,,,,, décentralisation industrielle ,"Sans doute , peut-on penser que les effets d' une politique de  décentralisation industrielle  ne peuvent se faire sentir que progressivement ; "
1792,,,,,,, le pourcentage des surfaces de planchers autorisées ,"à ce titre , la constatation que  le pourcentage des surfaces de planchers autorisées  en Région Parisienne par rapport au total autorisé en France est en 1958 de 21 %, au lieu de 33 % en 1999 est particulièrement nette et encourageante . "
1793,,,,sur le plan de <dyn,,,,"Il n'en subsiste pas moins l' urgente nécessité , si l' on ne veut pas assister à une aggravation du déséquilibre déjà trop évident entre PARIS et la province , d' intensifier cette politique hautement désirablesur le plan de > l' aménagement de l' ensemble du territoire  pour les activités , tant du secteur secondaire que du tertiaire. "
1795,,,,,,, aux constructions ,Les permis de construire correspondant  aux constructions  de moins de 500 m² de planchers n'ont pas été récapitulés . 
1797,,,,,,, Les activités , Les activités  sont essentiellement liées aux ressources naturelles du sol et du sous-sol ; 
1798,,,,,,, leurs localisations ne peuvent donc être fixées arbitrairement ," leurs localisations ne peuvent donc être fixées arbitrairement  et le choix de ces localisations ne peut , tout au plus , être tributaire que d' une sélection des matières premières et des produits de la terre . "
1799,,,,,,, pourront être éventuellement abandonnées ,"Par exemple , certaines terres de cultures de rendement médiocre  pourront être éventuellement abandonnées  au bénéfice de l' extension d' une cité ou de la création d' une zone industrielle ; "
1800,,,,,,," pourra être , en cas de nécessité , sacrifiée ","telle partie boisée  pourra être , en cas de nécessité , sacrifiée  pour permettre l' exploitation du sous-sol ; "
1801,,,,,,," seront ouvertes ,","des carrières  seront ouvertes , d' autres comblées et leur emplacement utilisé pour répondre aux besoins mouvants d' une population en accroissement . "
1802,,,,,,, l' exploitation ,"En Région Parisienne , les activités primaires se consacrent presque exclusivement à  l' exploitation  des ressources : — agricoles ( grosses cultures , cultures maraîchères et florales , cultures fruitières , arbustives ) ; — minières ( sable , gypse , pierre à bâtir , meulière , et récemment pétrole ). "
1805,,,,,,, d' un aménagement général de la Région .,"Il n'entre pas dans le cadre de la présente étude d' analyser en détail les lieux de production avec la nature et la valeur des éléments qui en sont extraits , mais de déterminer les mesures propres à protéger ou à développer ces ressources en fonction  d' un aménagement général de la Région . "
1806,,,,,,, l' ensemble de la Région Parisienne ,Les études particulières sur la valeur des sols de  l' ensemble de la Région Parisienne  et sur les cultures spécialisées ( arbustive et maraîchère ) au voisinage de l' agglomération ont été faites en liaison avec les services responsables du Ministère de l' Agriculture ; 
1807,,,,,,, du maintien ou du développement de ces activités ,"elles donnent tous les éléments qui permettront d' apprécier , en fonction des cas particuliers , l' intérêt  du maintien ou du développement de ces activités  par rapport à d' autres nécessités de la Région ou de l' agglomération . "
1808,,,,,,, les terres de très bonne qualité ,On doit cependant affirmer que  les terres de très bonne qualité  ; 
1810,,,,,,, des implantations ,les forêts ou bois publics ou privés entourant l' agglomération doivent être spécialement défendus contre  des implantations  qui ne seraient pas absolument nécessaires aux besoins des habitants de la Région Parisienne . 
1811,,,,au plan où les règles générales qu'il est proposé d' y appliquer s'inspirent de ce souci,,, consacrés à l' agriculture ,Les 10 . 000 km2 ( ou 1 . 000 . 000 d' hectares ) de la Région  consacrés à l' agriculture  ou occupés par des bois ou forêts sont compris dans la zone rurale déterminéeau plan où les règles générales qu'il est proposé d' y appliquer s'inspirent de ce souci. 
1812,,,,,,," 7 . 820 ha recensés consacrés aux cultures maraîchères , florales ou fruitières ","Sur les  7 . 820 ha recensés consacrés aux cultures maraîchères , florales ou fruitières  ( 1 ) situés dans l' agglomération parisienne ou à son voisinage immédiat , 2 . 160 ha correspondant à des ensembles de qualité de plus de 5 ha font l' objet d' une protection spéciale . "
1813,,,,,,, Les industries extractives , Les industries extractives  sont moins importantes par le chiffre de la main-d' œuvre qu'elles emploient que par l' utilité et la qualité des matériaux de toute nature qu'elles représentent . 
1814,,,,,,," pierre à bâtir de l' Île de France , de grès du Sud de Paris , de , pierre à plâtre , des collines entourant PARIS ont été depuis longtemps exploitées ","Les carrières de  pierre à bâtir de l' Île de France , de grès du Sud de Paris , de , pierre à plâtre , des collines entourant PARIS ont été depuis longtemps exploitées  pour les besoins propres à la Région( 1 ). "
1816,,,,,,, de consolidation de ces anciennes carrières ,"le problème  de consolidation de ces anciennes carrières  est très délicat , mais il est bien connu . "
1817,,,,,,, La construction ," La construction  est possible sur certains de leurs emplacements , mais elle est particulièrement onéreuse en raison des consolidations indispensables , et c'est surtout dans le sens de l' aménagement d' espaces verts que leur utilisation a été recherchée . "
1818,,,,,,, L'ouverture de nouvelles exploitations de gisements de sable et graviers ," L'ouverture de nouvelles exploitations de gisements de sable et graviers  ( la consommation de la Région Parisienne est annuellement de 13 millions de tonnes ) ou de gypse est parfois incompatible avec le maintien de l' occupation actuelle du sol ( cultures , espaces boisés ) ou de l' occupation envisagée ( affectation à l' habitation , forages pour l' alimentation en eau ) ou encore nuisible à l' aspect des lieux en détériorant un site remarquable ( carrières à flanc de coteau ). "
1819,,,,,,, peuvent être imaginées ,Des solutions existent ou  peuvent être imaginées  qui concilient cependant des points de vue divergents . 
1820,,,,,,, peuvent être réalisées ,"C'est ainsi , par exemple , que des zones d' activités industrielles  peuvent être réalisées  après exploitation de gisements de sable et remblaiement à une cote mettant les terrains hors de toute inondation ; "
1821,,,,,,, peuvent être réaménagés ,des sites  peuvent être réaménagés  avec création de plans d'eau artificiels après enlèvement du sable . 
1822,,,,,,, l' exploitation de nouveaux gisements ,Les difficultés que pourrait provoquer  l' exploitation de nouveaux gisements  sont évoquées dans une annexe technique spéciale qui traite de cette délicate question ; 
1823,,,,,,, un arbitrage éventuel ,"cette annexe précise en particulier , suivant la situation des terrains , les critères qui sont proposés pour déterminer  un arbitrage éventuel  entre les différents besoins . "
1824,,,,,,, La découverte récente de gisements de pétrole , La découverte récente de gisements de pétrole  n'a pas été sans émouvoir les défenseurs de la forêt de Fontainebleau et de ses abords . 
1825,,,,,,," d' interdire l' utilisation de ces gisements ,","S'il ne peut être question  d' interdire l' utilisation de ces gisements , le respect de certains sites faisant partie du patrimoine national impose que des dispositions soient prises , même si elles devaient être coûteuses , pour que cette exploitation ne constitue pas une atteinte à certaines régions . "
1827,,,,,,, un meilleur aménagement de la Région .,"L'importance de ces activités dans la Région Parisienne ayant été rappelée au Chapitre I , nous examinerons plus particulièrement leurs localisations , leur répartition , les superficies qu'elles occupent actuellement et celles qui seraient nécessaires pour  un meilleur aménagement de la Région . "
1829,,,,,,, Le développement des industries secondaires , Le développement des industries secondaires  s'est poursuivi depuis la fin du XIXe siècle d' une façon aussi anarchique quant à l' implantation des établissements que pour l' habitation . 
1830,,,,,,, a été peu à peu englobée .,"En fonction de ses besoins propres , chaque industrie recherchait soit la voie d' eau , soit simplement sa proximité pour l' utiliser selon ses besoins ( l' exemple des tanneries de la Bièvre est bien connu ), soit la voie ferrée , soit les deux , soit la limite d' une agglomération dans laquelle elle  a été peu à peu englobée . "
1831,,,,,,, La situation actuelle dans l' agglomération parisienne , La situation actuelle dans l' agglomération parisienne  se caractérise par la matérialisation d' un certain nombre de secteurs dans lesquels les industries sont en très grande majorité ; 
1832,,,,,,, se dessinent ,"ce sont de véritables zones industrielles de fait qui  se dessinent  en couronne autour de PARIS et plus particulièrement : — au Sud-Est , de Choisy-le-Roi à la Place Mazas ; — au Sud-Ouest , de Grenelle à Boulogne et Issy-les-Moulineaux ; — à l' Ouest et au Nord-Ouest , de Suresnes à Gennevilliers ; — au Nord , de Saint-Ouen et Saint-Denis à Blanc-Mesnil en passant par Aubervilliers , Pantin , La Courneuve . "
1833,,,,,,, sont implantées ,"Dans ces zones  sont implantées  en particulier les principales centrales gazières et électriques destinées à l' alimentation de la Capitale et de sa banlieue , les usines d' incinération d' ordures ménagères et certaines des industries les plus insalubres , produits chimiques , fonderies , etc . "
1834,,,,,,, l' atmosphère parisienne est la plus polluée ;,Ces zones sont parmi celles où  l' atmosphère parisienne est la plus polluée ; 
1836,,,,,,, placent ,"de plus , les vents dominants du bassin parisien , qui soufflent le plus souvent d' Ouest - Sud-Ouest ,  placent  certains secteurs proches de banlieue , occupés en majorité par de l' habitation , dans de mauvaises conditions et ceci à des distances dépassant parfois plusieurs kilomètres . "
1837,,,,,,, une quantité considérable d' installations d' importances variables sont dispersées ,"Indépendamment de ces grandes , taches , où se sont rassemblées les industries dites lourdes ,  une quantité considérable d' installations d' importances variables sont dispersées  dans la partie centrale de l' agglomération , aussi bien dans PARIS que dans la proche banlieue . "
1838,,,,,,, les zones d' industries lourdes qui occupent les plus grandes superficies ,"La comparaison de la carte des entreprises de plus de 50 salariés avec celle des emprises au sol , fait apparaître que  les zones d' industries lourdes qui occupent les plus grandes superficies  ne sont pas celles qui emploient , et de loin , le plus de main-d' œuvre . "
1839,,,,,,, d' une modernisation nécessaire .,Un certain nombre de ces industries lourdes ( les plus anciennes ont de 60 à 80 ans ) en arrivent au stade  d' une modernisation nécessaire . 
1840,,,,,,, sont rassemblées ,"Hors de l' agglomération , les principales industries  sont rassemblées  dans les vallées de la Seine et de l' Oise . "
1841,,,,,,," Les centres de MONTEREAU et de MELUN en amont de PARIS , de MANTES en aval , sont importants et assez diversifiés ."," Les centres de MONTEREAU et de MELUN en amont de PARIS , de MANTES en aval , sont importants et assez diversifiés . "
1842,,,,,,, s'est développée ,"L'industrie automobile  s'est développée  depuis la guerre dans la vallée de la Seine , à POISSY( SIMCA  ) et à FLINS( Renault ). "
1843,,,,,,," le plus important centre industriel de la Région Parisienne ,","L'agglomération de CREIL est  le plus important centre industriel de la Région Parisienne , extérieur à l' agglomération ; "
1845,,,,,,," Plusieurs centrales thermiques , ainsi que des cimenteries , sont échelonnées "," Plusieurs centrales thermiques , ainsi que des cimenteries , sont échelonnées  surtout le long de la Seine et de l' Oise . "
1846,,,,,,, les emprises industrielles importantes ,"Dans la zone rurale , en dehors des vallées ,  les emprises industrielles importantes  correspondent , dans la majorité des cas , à des industries liées à l' agriculture ( sucreries ou distilleries , etc .). "
1847,,,,,,," Des industries diverses , peu importantes , sont dispersées "," Des industries diverses , peu importantes , sont dispersées  dans la zone rurale , à l' exception de quelques unes liées aux produits du sol : terre réfractaire , dans la région de PROVINS , ou verreries à BAGNEAUX-SUR-LOING . "
1849,,,,,,, Les emprises industrielles les plus importantes sont localisées ," Les emprises industrielles les plus importantes sont localisées  pour PARIS et sa proche banlieue , mais les superficies les plus vastes ne sont pas toujours celles où la main-d' œuvre est la plus nombreuse . "
1852,,,,,,, 125 . 000 entreprises employant 1 . 180 . 0 salariés ,"En 1954 , et d' après une synthèse des renseigne-publiés par l' I . N . S . E . E . pour l' agglomération de PARIS , on dénombrait  125 . 000 entreprises employant 1 . 180 . 0 salariés  que l' on pouvait classer de la manière suivante : "
1857,,,,,,, l' importance considérable que représentent les 122 . 000 entreprises ( 1 ) de moins de 50 salariés ,"Cette répartition montre  l' importance considérable que représentent les 122 . 000 entreprises ( 1 ) de moins de 50 salariés  : 500 . 000 travailleurs sur 1 . 180 . 000 , c'est-à-dire plus de 40 %. "
1858,,,,,,," Les entreprises de 50 à 1 . 000 salariés n'atteignent pas tout à fait 40 % et celles de plus de 1 . 000 ,"," Les entreprises de 50 à 1 . 000 salariés n'atteignent pas tout à fait 40 % et celles de plus de 1 . 000 , parmi lesquelles toute l' industrie automobile , 18 % seulement de la main-d' œuvre . "
1859,,,,,,, d' après les renseignements de l' I . N . S . E . E .,"En 1958 , ces chiffres étaient  d' après les renseignements de l' I . N . S . E . E . les suivants ( 2 ) : "
1862,,,,,,, d' établissements ,Non déterminé TOTAL Nombre  d' établissements  104 . 555 13 . 496 3 . 032 851 92 3 . 809 125 . 0835 
1863,,,,,,, Différence 1958-1954 , Différence 1958-1954  : En plus………….. En moins……….. / 5 . 445 1 . 496 / 406 / 151 / / 13 / / 624 
