phrase_id,balise_lieu_obj,balise_lieu_loc,balise_act,balise_doc,balise_perc,balise_tps,balise_dyn,phrase
1108,,,,,,, sont de plus en plus menacés .,"Dans le même temps , les forêts , les parcs et les bois privés situés aux environs de PARIS , déjà très éprouvés au siècle dernier ,  sont de plus en plus menacés . "
1109,,,,le Plan,,, la création d' un parc de plusieurs centaines d' hectares ,"Pour faire face à cette insuffisance manifeste ,le Planconfirme la nécessité de  la création d' un parc de plusieurs centaines d' hectares  au nord de PARIS , et propose celle de 30 parcs intercommunaux. "
1110,,,,,,," une politique de préservation , de mise en valeur et d' acquisition d' espaces boisés privés existants ,","En outre ,  une politique de préservation , de mise en valeur et d' acquisition d' espaces boisés privés existants , est développée dans l' annexe relative à cette question . "
1111,,,,,,, de nouveaux groupes d' immeubles d' habitation ,"Enfin , il va sans dire qu'on ne saurait plus concevoir  de nouveaux groupes d' immeubles d' habitation  sans espaces verts , végétation traitée simplement avec des espèces d' arbres courantes et gazon accessible aux enfants . "
1112,,,,,,, sorte de terre ,"Encore faudra-t-il veiller à ce que cette verdure  sorte de terre  en même temps que les logements et non pas quelques années après , comme on le voit encore trop souvent ! "
1113,,,,,,, les installations industrielles nouvelles .,Le même cadre de verdure devra accompagner  les installations industrielles nouvelles . 
1114,,,,,,, toutes les zones d' activités .,Il en sera fait obligation dans le cahier des charges de  toutes les zones d' activités . 
1115,,,,,,, seront bordées ,"Enfin , les grandes voies de pénétration dans l' agglomération parisienne  seront bordées  d' une zone de plantations et de gazon . "
1116,,,,,,, l' abondance des espaces verts ,"Indispensable à l' équilibre physique et psychique des Parisiens ,  l' abondance des espaces verts  est devenue une nécessité vitale . "
1118,,,,,,," particulièrement sèche ,","En 1957 , année  particulièrement sèche , le volume record distribué à la population a été de 2 . 300 . 000 m3 par jour . "
1120,,,,,,, l' accroissement de la consommation d' eau par habitant ,"L'augmentation de la population et des besoins individuels résultant de  l' accroissement de la consommation d' eau par habitant  nécessiterait , dans l' hypothèse de 9 . 000 . 000 d' habitants pour la Région Parisienne , 3 . 650 . 000 m3 d' eau potable par jour . "
1121,,,,,,, la multiplication des forages ,"Or ,  la multiplication des forages  est limitée par les baisses de pression qui peuvent en résulter dans les nappes phréatiques et l' augmentation des puisages par le débit des étiages de la Seine . "
1122,,,,,,, 1 . 350 . 000 m3 par jour .,Il est donc nécessaire de pouvoir combler cette insuffisance par rapport aux possibilités actuelles de  1 . 350 . 000 m3 par jour . 
1123,,,,,,, Quelques captages supplémentaires et le perfectionnement des puisages en service , Quelques captages supplémentaires et le perfectionnement des puisages en service  ; 
1124,,,,,,, l' accroissement du débit des étiages ," l' accroissement du débit des étiages  par la construction de barrages en amont sur la Seine et la Marne , apporteront une amélioration certaine . "
1125,,,,,,, soit amené à faire appel à d' autres ressources à provenir éventuellement de l' extérieur de la région .,Mais il n'est pas exclu que l' on  soit amené à faire appel à d' autres ressources à provenir éventuellement de l' extérieur de la région . 
1126,,,,au programme général d' assainissement de la Région,,, sont actuellement exécutés.,L'ASSAINISSEMENT 40 % seulement des ouvrages prévusau programme général d' assainissement de la RégionParisienne étudié depuis de longues années  sont actuellement exécutés. 
1127,,,,,,, L'équipement de la station centrale d' épuration d' ACHERES ( Seine-et-Oise ) ne permet de traiter que 15 % de l' effluent , L'équipement de la station centrale d' épuration d' ACHERES ( Seine-et-Oise ) ne permet de traiter que 15 % de l' effluent  : sur les 12 cellules prévues initialement une seule est actuellement en service . 
1128,,,,,,, des déversements en Seine ,"Cette situation conduit , lorsque les débits atteignent une certaine importance , à  des déversements en Seine  de l' ordre de 500 . 000 m3 par jour . "
1129,,,,,,, Cet effluent est certes dilué mais est néanmoins très préjudiciable aux intérêts des riverains , Cet effluent est certes dilué mais est néanmoins très préjudiciable aux intérêts des riverains  en aval de PARIS . 
1130,,,,,,, Le débit journalier actuel de l' effluent , Le débit journalier actuel de l' effluent  est de 2 . 000 . 000 m3 par jour . 
1132,,,,du programme général des ouvrages d' assainissement,,, d' accroître le rythme d' exécutiondu programme général des ouvrages d' assainissement.,Il est donc indispensable  d' accroître le rythme d' exécutiondu programme général des ouvrages d' assainissement. 
1133,,,,,,," devrait être équipée pour traiter au moins 80 % de l' effluent futur ,","La station d'épuration d' ACHÈRES notamment  devrait être équipée pour traiter au moins 80 % de l' effluent futur , le complément restant tributaire des champs d' épandage de la ville de PARIS . "
1135,,,,,,, inhumations ,Il n'est pas jusqu'au problème des  inhumations  qui ne se pose avec une acuité particulièrement grande dans l' agglomération parisienne . 
1136,,,,,,, inhumer leurs morts .,Toutes les communes éprouvent actuellement dans ce domaine des difficultés pour  inhumer leurs morts . 
1137,,,,,,," la création de nouveaux cimetière s ,","L'évolution démographique exige  la création de nouveaux cimetière s , et ce problème demande à être résolu très rapidement dans plusieurs secteurs . "
1138,,,,"plus sur le plan communal , mais sur le plan intercommunal , voire régional , que <dyn",,,,"Ce n'estplus sur le plan communal , mais sur le plan intercommunal , voire régional , que > des solutions doivent être trouvées. "
1139,,,,,,," Ces nouveaux cimetières ne devraient plus avoir le caractère de lotissements funéraires ,"," Ces nouveaux cimetières ne devraient plus avoir le caractère de lotissements funéraires , mais celui de cimetières -par cs à l' exemple de certaines réalisations étrangères . "
1140,,,,,,, est en cours de réalisation ,Un cimetière intercommunal traité dans cet esprit  est en cours de réalisation  à CLAMART ; 
1141,,,,,,, doivent être réservés ,d' autres sont en projet et les emplacements nécessaires  doivent être réservés  ; 
1142,,,,,,, doivent être dès maintenant localisés .,mais des emplacements plus importants destinés à constituer quelques cimetières régionaux ou de district  doivent être dès maintenant localisés . 
1144,,,,,,," les problèmes qui se posent dans les grandes agglomérations , celui des établissements pénitentiaires ","LES PRISONS Enfin , parmi  les problèmes qui se posent dans les grandes agglomérations , celui des établissements pénitentiaires  n'est pas toujours des plus commodes à résoudre . "
1145,,,,,,, ont été implantés progressivement ,"Un certain nombre d' établissements  ont été implantés progressivement  en fonction des besoins , d' abord au centre de PARIS: la Roquette et la Santé , ensuite à la limite de l' agglomération : FRESNES . "
1146,,,,,,, ont été installées ,"En outre , des prisons  ont été installées  dans certaines villes : à MELUN( dans une île sur la Seine), à VERSAILLES( dans le centre de la ville ), à POISSY( dans une ancienne Abbaye). "
1147,,,,,,, regrouper dans un établissement moderne les plus anciens de ces établissements ,Le Ministère de la Justice envisage de  regrouper dans un établissement moderne les plus anciens de ces établissements  — notamment la Roquette et la Santé qui ne sont plus adaptés aux besoins actuels — et les établissements anciens pour lesquels des transformations importantes entraîneraient des dépenses très élevées . 
1148,,,,,,, d' un tel établissement ,La localisation  d' un tel établissement  n'est pas sans soulever de nombreuses protestations . 
1149,,,,,,, d' accès et de sécurité qui rendent un choix très difficile .,Il doit cependant répondre à un certain nombre de considérations de commodités  d' accès et de sécurité qui rendent un choix très difficile . 
1151,,,,,,, s'accroît d' année en année .,"Il ne semble pas utile d' examiner successivement le niveau des équipements divers d' influence locale pour affirmer que dans ce domaine , plus encore que dans celui des services publics régionaux , apparaît une insuffisance qui  s'accroît d' année en année . "
1152,,,,,,, des équipements déjà saturés ,"Ce sont les changements importants survenus dans la répartition géographique de la population , l' augmentation générale des niveaux de vie , face à  des équipements déjà saturés  qui en sont à l' origine . "
1154,,,,,,," la  volonté des maires ont permis , avec une aide financière de l' État , et des possibilités de prêts qu'ils souhaiteraient mieux adaptés à  la  situation ,  la  réalisation de nombreux bâtiments administratifs , culturels ou sociaux , d' écoles , de crèches , de dispensaires , de foyers de jeunes travailleurs , etc . sans oublier les bureaux de postes , marchés , travaux de voirie ou de réseaux locaux d' eau et d' assainissement ... Et que penser du Maire qui doit faire face en 20 ans , souvent 10 et parfois moins , à un doublement ou un triplement de  la  popu la ","Le dynamisme et  la  volonté des maires ont permis , avec une aide financière de l' État , et des possibilités de prêts qu'ils souhaiteraient mieux adaptés à  la  situation ,  la  réalisation de nombreux bâtiments administratifs , culturels ou sociaux , d' écoles , de crèches , de dispensaires , de foyers de jeunes travailleurs , etc . sans oublier les bureaux de postes , marchés , travaux de voirie ou de réseaux locaux d' eau et d' assainissement ... Et que penser du Maire qui doit faire face en 20 ans , souvent 10 et parfois moins , à un doublement ou un triplement de  la  popu la tion de sa commune , sinon qu'il a un mérite énorme à ne pas se décourager ! "
1156,,,,,,," l' état actuel de la Région Parisienne ,","Dans les pages qui précèdent ont été exposées aussi synthétiquement que possible les constatations qu'appelle  l' état actuel de la Région Parisienne , les propositions de principe pour y remédier ainsi que les localisations possibles des principaux éléments qui en permettraient l' application. "
1157,,,,,,, le déplacement d' un aéroport ou la création d' un réseau express régional ,"Certaines de ces propositions supposent des options importantes qui ne pourront , dans certains cas , être prises qu'après des études détaillées notamment dans les domaines économique et financier :  le déplacement d' un aéroport ou la création d' un réseau express régional  en sont deux exemples importants . "
1158,,,,,,, ces opérations principales ,"Toutes  ces opérations principales  ne pourront sans doute pas , pour des raisons financières , être entreprises en même temps et un ordre d' urgence devra être établi . "
1159,,,,,,, la vie continue ,Et cependant  la vie continue  qui nécessite chaque jour des décisions à prendre . 
1160,,,,,,," possibilités de réalisation ,","C'est pourquoi il a paru nécessaire , tout en laissant aux propositions faites les plus larges  possibilités de réalisation , de fixer dès maintenant les points précis que des obligations ou des accords pris conduisent à considérer comme des éléments à peu près certains de toute évolution ultérieure pendant les prochaines années . "
1161,,,,,,, leur approbation .,Cet ensemble de dispositions a été condensé dans deux documents qui ont été soumis à la consultation régionale prévue par la législation en vigueur avant leur examen par les divers Ministres intéressés en vue de  leur approbation . 
1162,,,,- UN PLAN DIRECTEUR à ,,,l' échelle du 1/50. 000e .,- UN PLAN DIRECTEUR à l' échelle du 1/50. 000e . 
1164,,,,,,," d' équipement , les dispositions proposées et résument la documentation nécessaire qui a éclairé les choix indispensables .","DIX HUIT TECHNIQUES COMPLÉMENTAIRES reprennent , par nature  d' équipement , les dispositions proposées et résument la documentation nécessaire qui a éclairé les choix indispensables . "
1166,,,,,,, les études d' urbanisme intercommunales ou de détail qui en fixeront les limites géographiques exactes.,Il comporte les dispositions générales de caractère régional qui serviront de directives précises pour  les études d' urbanisme intercommunales ou de détail qui en fixeront les limites géographiques exactes. 
1167,,,,,,," l' organisation de la région ,","Sans reprendre toutes les suggestions évoquées dans le présent rapport pour  l' organisation de la région , il ne s'y oppose pas et réserve la possibilité d' en exécuter les opérations principales . "
1168,,,,,,, la Reconstruction et du Logement .,Ce plan est la suite logique de celui qui fut pris en considération le 12 janvier 1956 par M . le Ministre de  la Reconstruction et du Logement . 
1169,,,,,,, sa présentation est polychrome pour être plus claire .,"Établi à la même échelle ,  sa présentation est polychrome pour être plus claire . "
1170,,,,"au plan précédent ,",,," un assez grand nombre de modifications apportées pour tenir compte des observations présentées par le Conseil Municipal de PARIS   et les Conseils Généraux des départements de la Seine , Seine -et- Oise , Seine-et-Marne et Oise ","Il comporte , par rapportau plan précédent , un assez grand nombre de modifications apportées pour tenir compte des observations présentées par le Conseil Municipal de PARIS   et les Conseils Généraux des départements de la Seine , Seine -et- Oise , Seine-et-Marne et Oise  dans leurs délibérations respectives des : — 28 juin 1956 , — 26 décembre 1957 , — 21 , 22 mars 1957 , — Ier mars 1957 , — 24 juin 1957 , ainsi que celles du Conseil Municipal de PARIS   sur le plan directeur d' urbanisme de PARIS   les 26 et 27 octobre 1959. "
1172,,,,,,, les questions d' aménagement régional ,"Il a été complété sur un grand nombre de points à la suite des études poursuivies avec les différents services publics et collectivités depuis 1956 , en particulier avec les principaux Ministères intéressés par  les questions d' aménagement régional  : — Ministère des Travaux Publics et des Transports . "
1178,,,,de  Plan d' Urbanisme Directeur de PARIS  dont il confirme les dispositions essentielles,,, Plan d' Urbanisme Directeur de PARIS ,Il s'articule avec le projetde  Plan d' Urbanisme Directeur de PARIS  dont il confirme les dispositions essentielles. 
1179,,,,,,, LES ZONES URBAINES ET LA ZONE RURALE ,A - DÉLIMITATION ENTRE  LES ZONES URBAINES ET LA ZONE RURALE  
1181,,,,sur le plan,,," Par ordre d' importance ,"," Par ordre d' importance , on pourra distinguersur le planles éléments suivants : "
1182,,,,,,, l' agglomération parisienne.,"Les zones urbaines comprennent les principales agglomérations et , en particulier ,  l' agglomération parisienne. "
1183,,,,au plan de 1956 ( 1 ),,," un certain nombre de rectifications ou d' adaptations ,","Elles sont définies par un périmètre qui reprend , avec  un certain nombre de rectifications ou d' adaptations , les limites proposéesau plan de 1956 ( 1 ). "
1184,,,,,,, ne seront pas autorisés ,"Sauf exception justifiée d' une manière irréfutable par des besoins locaux pressants , les groupes importants d' habitations  ne seront pas autorisés  hors de ces périmètres , qui représentent des possibilités suffisantes pour les besoins des agglomérations pendant les prochaines années . "
1186,,,,,,, le développement tentaculaire et désordonné des agglomérations et notamment de l' agglomération parisienne .,Un des buts essentiels de ces périmètres est d' éviter  le développement tentaculaire et désordonné des agglomérations et notamment de l' agglomération parisienne . 
1188,,,,,,, d' aménagement d' ensemble de caractère régional .,Plusieurs périmètres importants indiquent des secteurs pouvant ou devant faire l' objet  d' aménagement d' ensemble de caractère régional . 
1189,,,,,,, noyaux principaux de restructuration ,"Ces secteurs , compte tenu de l' état actuel des études , ne sont qu'au nombre de 3 correspondant aux 3  noyaux principaux de restructuration  évoqués au Chapitre 3 . "
1190,,,,,,, l' aérodrome Nord de Paris .,Il s'y ajoute une zone d' étude de  l' aérodrome Nord de Paris . 
1191,,,,,,, d' autres secteurs pourront être ultérieurement envisagés .,Il va sans dire que  d' autres secteurs pourront être ultérieurement envisagés . 
1192,,,,au plan ,,, La délimitation des secteurs inscritsau plan ," La délimitation des secteurs inscritsau plan correspond à des territoires dans lesquels il est impossible , dans l' état actuel des études , de déterminer de façon précise les dispositions à retenir. "
1193,,,,,,, l' avenir ,"Cependant , les limites proposées sont suffisamment larges pour sauvegarder  l' avenir  en fonction des options qui sont à prendre . "
1194,,,,,,, L'acquisition ," L'acquisition  par la collectivité des terrains compris dans ces secteurs ( environ 1 . 500 ha en dehors des emprises appartenant à l' Etat ) serait la meilleure garantie de leur bonne utilisation ultérieure , la meilleure lutte contre la spéculation et la meilleure manière de récupérer les éventuelles plus-values qu'ils peuvent prendre . "
1195,,,,,,, aucune construction ,"En tout état de cause ,  aucune construction  de nature à en compromettre l' utilisation ultérieure n'y sera autorisée . "
1196,,,,,,, les zones à urbaniser ,D'autres périmètres délimitent  les zones à urbaniser  avec une différenciation particulière pour celles qui doivent l' être par priorité . 
1197,,,,,,, d' opérations de grands ensembles d' habitations ,"Ces zones représentent au total , indépendamment des secteurs précédents , plus de 5 . 000 ha dans la seule agglomération parisienne , dont 4 . 000 peuvent faire l' objet  d' opérations de grands ensembles d' habitations  , avec services publics et espaces verts . "
1199,,,,dont le programme,,, L'aménagement de ces zones ," L'aménagement de ces zones  doit faire l' objet de plans de détaildont le programmedéterminera de façon précise le caractère des divers types d' habitat à y admettre ( collectifs élevés et moyens et aussi , dans certains cas , individuels ), les lieux de travail et les services publics correspondants , etc. "
1200,,,,,,, devant faire l' objet de rénovation ,"Les secteurs  devant faire l' objet de rénovation  ( qui correspondent à des quartiers insalubres , vétustes ou mal occupés ) sont indiqués , tant à PARIS-même que dans les autres communes de l' agglomération parisienne . "
1203,,,,Le Plan,,, les zones d' activités industrielles projetées ;,Le Planindique les zones industrielles existantes ( industries ou entrepôts ) et  les zones d' activités industrielles projetées ; 
1204,,,,,,, le desserrement des activités trop concentrées ,ces dernières destinées à permettre  le desserrement des activités trop concentrées  ( dans la mesure où elles seront autorisées à rester dans la Région Parisienne) et leur meilleure distribution en fonction de la répartition actuelle ou prévue des populations. 
1205,,,,au Plan,,, Les zones nouvelles prévuesau Planreprésentent 1. 500 ha dont 1 . 000 ha dans l' agglomération parisienne proprement dite , Les zones nouvelles prévuesau Planreprésentent 1. 500 ha dont 1 . 000 ha dans l' agglomération parisienne proprement dite  et 500 dans le reste de la région . 
1206,,,,,,, ces zones nouvelles ,Les conditions d' utilisation de  ces zones nouvelles  sont précisées dans le Règlement . 
1207,,,,,,, LES ESPACES VERTS ÉQUIPEMENTS CULTURELS ET SPORTIFS ,*** D -  LES ESPACES VERTS ÉQUIPEMENTS CULTURELS ET SPORTIFS  
1208,,,,Le plan,,, les espaces verts à protéger et ceux à créer ou à aménager ,"Le plancomporte  les espaces verts à protéger et ceux à créer ou à aménager  , ainsi que les parcs de sports , bassins nautiques à réaliser , etc. "
1209,,,,,,, les nouvelles constructions .,Il détermine : a ) UNE ZONE DE PROTECTION GÉNÉRALE RECOUVRANT 5 . 000 km2 de la région dans laquelle une attention particulière devra être apportée pour  les nouvelles constructions . 
1210,,,,,,, les sites importants à protéger ;,"Cette zone englobe toutes les parties particulièrement sensibles , les rives des fleuves ,  les sites importants à protéger ; "
1211,,,,,,, LA CRÉATION DE 30 PARCS PUBLICS intercommunaux ,"b ) 16 RÉGIONS TOURISTIQUES ET 1 . 000 km de routes touristiques avec une règlementation appropriée ; c ) 19 SITES PRINCIPAUX assortis d' une protection particulière ; d )  LA CRÉATION DE 30 PARCS PUBLICS intercommunaux  représentant une superficie de 1 . 500 ha , dont une partie pourra être aménagée en plaines de jeux et de sports . "
1214,,,,,,, grandes installations sportives et des Centres d' Exposition .,Une annexe spéciale L traite particulièrement du problème des  grandes installations sportives et des Centres d' Exposition . 
1215,,,,,,, Les localisations possibles et souhaitables des grandes installations culturelles et sportives , Les localisations possibles et souhaitables des grandes installations culturelles et sportives  dans la Région Parisienne sont évoquées en détail dans l' annexe L . 
1217,,,,,,, un futur stade de 100 . 000 places ,Parmi les solutions possibles pour  un futur stade de 100 . 000 places  : soit — si ce stade doit être parisien — Vincennes( des précautions particulières devant être prises pour la sauvegarde du Bois de Vincennes— libéré par ailleurs et en tout état de cause des installations militaires qui l' encombrent — et de ses abords ). 
1218,,,,,,, un ,soit — si la conception doit porter plus largement sur  un  futur parc olympique avec installations nautiques — la Plaine de Montesson . 
1220,,,,,,, 4 emplacements de sports nautiques ,"2 .  4 emplacements de sports nautiques  sur la Seine: 2 en amont de Paris , 2 en aval ; 3 . "
1223,,,,Le plan détermine ,,,"le réseau routier principal à conserver , à aménager ou à créer ","Le plan détermine le réseau routier principal à conserver , à aménager ou à créer  pour assurer une desserte meilleure des populations existantes et des noyaux prévus pour la restructuration de la banlieue. "
1224,,,,,,, devront faire l' objet d' aménagement ,Il précise celles qui  devront faire l' objet d' aménagement  permettant de leur donner le caractère de voies à circulation rapide et à grand débit . 
1225,,,,,,, possibilités concrètes de réalisation ,Les tracés proposés résultent de  possibilités concrètes de réalisation  déterminées à la suite d' études nombreuses et complexes avec les différents services techniques et notamment ceux du Ministère des Travaux Publics et des Transports  . 
1229,,,,,,, L'amélioration ," L'amélioration  de la circulation dans PARIS notamment par l' aménagement d' une voie de liaison Nord-Sud , de la rocade des Fermiers Généraux et de certaines radiales ; 2 . "
1230,,,,,,, L'ouverture de 1 . 140 km de voies nouvelles ," L'ouverture de 1 . 140 km de voies nouvelles  comprenant : — 300 km d' autoroutes ou de voies à circulation rapide privilégiée y compris la rocade périphérique de PARIS( 40 km ), — 500 km d' ouverture ou de déviation de routes nationales , — 340 km d' ouverture ou de déviation de chemins départementaux ; 3 . "
1232,,,,,,, l' aménagement de 200 carrefours à niveaux différents ,Il prévoit également  l' aménagement de 200 carrefours à niveaux différents  et la création de nombreux parcs de stationnement . 
1234,,,,,,, des carrefours aménagés ,Le réseau des circulations dans la Région Parisienne doit évoluer vers une différenciation entre les voies conçues pour une circulation rapide et à grand débit avec  des carrefours aménagés  à différents niveaux et les voies de desserte des quartiers ou groupes de quartiers destinées à la circulation locale. 
1235,,,,Le schéma général,,, les opérations ,"Le schéma généralindique  les opérations  qui , en fonction de la situation existante et de l' évolution prévisible ou souhaitable de certains secteurs , peuvent être inscrites au Plan d' Aménagement et d' Organisation Générale de la Région Paris ienne. "
1237,,,,Le plan,,, le  report des gares parisiennes à la périphérie de la Capita  le ,Le planne comporte aucune disposition prévoyant  le  report des gares parisiennes à la périphérie de la Capita  le . 
1238,,,,,,, pratiquement réalisable ,"Cette suggestion , exprimée à maintes reprises , n'a pas été reconnue  pratiquement réalisable  en raison des investissements considérables qu'elle impliquerait ( 2 ). "
1239,,,,le plan,,," l' intégration du réseau de banlieue de la S . N . C . F .,","Par contre ,  l' intégration du réseau de banlieue de la S . N . C . F ., dans un réseau régional express superposé au métropolitain omnibus de PARIS est affirmée dans son principe etle planindique les principales lignes qui devraient faire l' objet d' études ( transversales Est-Ouest et Nord-Sud , liaison Versailles "
