phrase_id,balise_lieu_obj,balise_lieu_loc,balise_act,balise_doc,balise_perc,balise_tps,balise_dyn,phrase
2,,,,,,, l' abandon ,"Quand j'étais enfant et que je vivais dans une vallée des Alpes , j'avais pour habitude d' explorer avec une amie le versant montueux en face de chez moi , où  l' abandon  marquait les champs autrefois cultivés en terrasse , les chemins et les maisons en pierre . "
3,,,,,,, une catastrophe avait été annoncée et avait entraîné une fuite rapide et généralisée .,"Tout était resté là , comme si l' on s'était absenté pour une courte période , ou comme si  une catastrophe avait été annoncée et avait entraîné une fuite rapide et généralisée . "
4,,,,,,, s'étaient consommées ,"À l' intérieur , des objets , des meubles , des images parlaient des vies qui  s'étaient consommées  dans des conditions souvent très dures . "
5,,,,,,, passions des après-midi entiers en exploration ,"Nous , qui  passions des après-midi entiers en exploration  sans que personne s'en soucie , nous nous racontions des histoires à partir de ces traces et de ces lieux autrefois habités . "
6,,,,,,," de plus en plus abandonnée ,","La montagne était  de plus en plus abandonnée , au profit de la plaine où la , ville diffuse , était en train de se former avec la nouvelle richesse qui touchait aussi cette vallée , dans l' Italie du boom économique . "
7,,,,,,, la construction territoriale ,"Plus tard , à l' école d' architecture de Florence , j'ai eu la chance de suivre pendant quelques années les recherches de Gianfranco Caniggia , le meilleur élève de Saverio Muratori , un professeur important , entouré d' assistants , qui donnait des cours fascinants non seulement sur l' évolution typologique du tissu urbain de Florence , mais aussi sur  la construction territoriale  dans le temps long . "
8,,,,,,, l' élaboration de théories ,"Pendant les trois ans au cours desquels je l' ai suivi , j'ai eu le temps d' élaborer une position critique envers ses théories , mais aussi d' en apprécier la rigueur et j'ai compris que  l' élaboration de théories  faisait partie du métier de l' architecte . "
9,,,,,,, les autres professeurs de projet ,Tous  les autres professeurs de projet  m'ont immédiatement paru en être dépourvus . 
10,,,,,,, un détail de construction ,"Après mon diplôme et quelques expériences de bottega , c'est-à-dire en agences , j'ai renforcé cette conviction : le fait même de dessiner  un détail de construction  nécessite l' élaboration d' une théorie . "
11,,,,,,, La Spezia et Val di Magra ," La Spezia et Val di Magra  Schéma des typologies : la ,quadra, et son complément , le système en peigne de la colline . "
12,,,,Plan de coordination territoriale de La Spezia et ,,,"Plan de coordination territoriale de La Spezia et Val di Magra ,","Plan de coordination territoriale de La Spezia et Val di Magra , 1993. "
14,,,,,,, j'ai commencé à collaborer avec Bernardo Secchi que je lisais étudiante dans les pages de la revue Casabella .,"Durant cette période ,  j'ai commencé à collaborer avec Bernardo Secchi que je lisais étudiante dans les pages de la revue Casabella . "
15,,,,,,," l' analyse de la plaine entre Florence et Prato ,","C'est par  l' analyse de la plaine entre Florence et Prato , à la fin des années 1980 , que nos discussions ont commencé . "
16,,,,,,, les questions de structure territoriale ,"L'enseignement de Caniggia rendait pour moi cette échelle et  les questions de structure territoriale  très lisibles , et cela l' a surpris . "
17,,,,,,, La Spezia( en Ligurie),"Il travaillait alors à  La Spezia( en Ligurie) où il avait constitué une équipe coordonnée par des architectes locaux plus expérimentés , mais distants de son école de pensée . "
18,,,,était un plan territorial,,, une équipe de jeunes architectes enthousiastes ,Je me suis alors retrouvée à gérer  une équipe de jeunes architectes enthousiastes  sans même savoir alors ce qu'était un plan territorial. 
19,,,,,,, la province de La Spezia et du Val di Magra ,Celui de  la province de La Spezia et du Val di Magra  a été pour moi une occasion formidable pour le comprendre . 
20,,,,le plan pour <lieu type,,, le développement de la nouvelle zone d' activités ,"Après quelques années de travail à Prato , La Spezia , Ascoli Piceno(le plan pour =obj>le centre historique ) et à Courtrai en Belgique( où Bernardo Secchi avait été invité à participer au concours pour  le développement de la nouvelle zone d' activités  de Courtrai( Hoog Kortrijk ) que nous avons gagné en 1989 ), j'ai décidé de candidater à une bourse pour mener un doctorat en composition architecturale. "
21,,,,,,, le projet n'habitait pas les recherches des planners ,"À cette époque , je pensais que  le projet n'habitait pas les recherches des planners  et j'avais probablement raison . "
22,,,,,,, dessinions des projets .,"J'étais également assistante de Bernardo Secchi dans son cours d' urbanisme à l' université IUAV de Venise et j'ai passé des années à prendre des notes : pendant des cours , officiels ,, à l' université , mais aussi pendant des cours , officieux ,, dans les innombrables réunions et présentations dans les villes pour lesquelles nous  dessinions des projets . "
23,,,,des plans régulateurs </dyn,,,,"Nous avions fondé Studio en 1990 , la période  d' élaborationdes plans régulateurs > en Italie. "
24,,,,,,," d' autres villes plus petites ,","Nous avons ainsi travaillé à Bergamo , Brescia , Prato , Pesaro et dans  d' autres villes plus petites , du nord au sud de l' Italie avec des équipes montées sur place en y associant les équipes municipales . "
25,,,,,,, les petites entreprises installées ,"Cette expérience a été une édition originale et personnelle du , Voyage en Italie , : à travers ce pays riche et surprenant des années 1990 , durant lesquelles  les petites entreprises installées  dans la ville diffuse avaient été capables de renverser la crise de la grande industrie des précédentes décennies en un nouvel espace social , économique et territorial ; "
26,,,,,,, dégradait de plus en plus la possibilité de faire de l' urbanisme .,années durant lesquelles aussi le système politique italien  dégradait de plus en plus la possibilité de faire de l' urbanisme . 
27,,,,,,, la construction du projet ,"Au cours de ces expériences , j'ai pu comprendre  la construction du projet  comme élaboration de procédures et non seulement comme composition d' éléments suivant des grammaires et des syntaxes . "
28,,,,,,, construction de l' espace ,Le projet proposait des règles de  construction de l' espace  qui régissent une variété de configurations et de jeux d' acteurs . 
29,,,,,,, ont tellement changé ,"Aujourd'hui , avec une distance toujours plus marquée vis-à-vis de cette période d' expérimentation de ,nouvelles stratégies cognitives,, je pense qu'une nouvelle expérience de , Voyage , est nécessaire pour comprendre comment , en l' espace de deux décennies , les choses  ont tellement changé  et pour lire à nouveau les potentialités de ces territoires . "
31,,,,,,, le très fameux voyage en Italie ,"On peut citer comme référence , parmi tant d' autres ,  le très fameux voyage en Italie  de Goethe à la fin du XVIIIe siècle . "
34,,,,,,, décrire et de dessiner la ville contemporaine ,"Le , courage de l' hypothèse , Ma recherche doctorale était intimement liée à ce que j'expérimentais tous les jours : la nécessité de  décrire et de dessiner la ville contemporaine  avec son espace fragmenté et peu lisible . "
35,,,,,,," nouvelles situations urbaines ,","Le projet s'occupait des  nouvelles situations urbaines , des matériaux qui constituaient son espace , des relations entre les choses , des mots qu'on utilise pour les décrire , des pratiques qui les investissent . "
36,,,,,,, le projet de la ville et de l' architecture .,"La Città elementare , livre publié à partir de ma thèse terminée en 1993 , propose un retour à un point de vue élémentariste qui traverse cycliquement  le projet de la ville et de l' architecture . "
37,,,,,,, des ,"Il suit une ,linea analitica , qui interprète la complexité urbaine à travers  des  opérations de déconstruction et de construction de ses matériaux : maisons , entrepôts , champs cultivés , réseaux , routes ... "
38,,,,,,," l' espace ouvert comme nouvelle structure de l' espace contemporain ,","Trois thèmes montraient à quel niveau la ville des exercices élémentaristes était différente de l' image figée qui limitait nos regards : la Reverse City avec  l' espace ouvert comme nouvelle structure de l' espace contemporain , la nature sérielle du projet de la ville et le système pavillonnaire , l' épaisseur de l' architecture qui tend vers 0 , le sol comme bas-relief . "
39,,,,,,, Ces thèmes étaient investigués , Ces thèmes étaient investigués  à travers une série de projets qui identifiaient des traditions de projet d' urbanisme et d' architecture . 
40,,,,,,, l' architecture comme exploration de tracés et de concepts ,"Je voudrais , à ce point , rendre hommage à Gianugo Polesello , architecte lucide et cultivé qui portait une attention maniaque à  l' architecture comme exploration de tracés et de concepts  : avec Bernardo Secchi , il a été mon directeur de thèse . "
41,,,,,,, abstractions et figures de l' espace .,Polesello a travaillé pendant des décennies sur les mêmes  abstractions et figures de l' espace . 
42,,,,,,," ses séminaires , il nous conduisait à travers ses souvenirs savants et ses images récurrentes , entre Queneau et Malevitch .","Dans  ses séminaires , il nous conduisait à travers ses souvenirs savants et ses images récurrentes , entre Queneau et Malevitch . "
43,,,,,,, Métamorphose de l' ordinaire ,"L'architecture se présentait alors comme un processus logique , un jeu qui se déroulait à travers son  Métamorphose de l' ordinaire  2322 Grand Prix de l' urbanisme 2013 propre dessin et dans le dessin . "
44,,,,,,, ses projets ,"Il ne décrivait pas  ses projets  car ceux-ci devaient , à eux seuls , être capables d' auto-explication . "
45,,,,le plan directeur de <lieu type=,,, avons réalisée ,"La place du Théâtre à Anvers , que nous  avons réalisée  entre 2005 et 2007 , résultat d' un concours organisé lorsque nous élaborionsle plan directeur de obj>la ville , est un hommage à la leçon de rigueur de cet architecte et professeur. "
46,,,,,,, mon parcours ,"Toutefois , Polesello n'a pas été la seule figure marquante rencontrée durant  mon parcours  pendant cette période . "
47,,,,ses textes et sa bibliothèque,,, fréquentant longuementses textes et sa bibliothèqueà Genève a profondément marqué mon parcours.,"La posture de recherche développée par André Corboz , que j'ai étudié en  fréquentant longuementses textes et sa bibliothèqueà Genève a profondément marqué mon parcours. "
48,,,,de son article,,, l' étude monumentale qu'il a consacrée au peintre vénitien Canaletto.,"Pendant plusieurs années , j'ai suivi les hiéroglyphes de sa pensée , attirée non seulement par , le territoire comme palimpseste , qui avait retenu l' attention de beaucoup d' entre nous en Italie après la publicationde son articledans Casabella , mais également par sa conception même de la recherche , telle qu'elle ressortait de livres comme  l' étude monumentale qu'il a consacrée au peintre vénitien Canaletto. "
49,,,,de ses textes,,," l' ouverture à des interprétations nouvelles et inusitées ,","Dans l' introduction à l' anthologiede ses textes, Ordine Sparso , que j'ai publiée en italien en 1998 , j'écrivais que , le “courage de l' hypothèse”, la nécessité de s'extraire des démarches établies et préconstituées , la conviction que la recherche construit elle-même son objet au cours du travail , et enfin  l' ouverture à des interprétations nouvelles et inusitées , caractérisent l' œuvre d' André Corboz ,. "
50,,,,,,," n'a rien à voir avec une conjecture , c'est une expérience .","Une hypothèse , selon Max Friedländer ,  n'a rien à voir avec une conjecture , c'est une expérience . "
51,,,,,,, l' ouverture intellectuelle et affective à une expérience de recherche et de projet .,"Le courage de l' hypothèse est , dans mon travail ,  l' ouverture intellectuelle et affective à une expérience de recherche et de projet . "
52,,,,,,, l' utilisation de toutes nos ressources mentales et de toutes les énergies physiques de notre propre corps ,"L'hypothèse implique  l' utilisation de toutes nos ressources mentales et de toutes les énergies physiques de notre propre corps  : c'est une pratique totale , qui inclut la prise de distance critique . "
54,,,,Le plan directeur pour  la ville de Pesaro,,, la ville de Pesaro,"Le plan directeur pour  la ville de Pesaro constitue un projet en soi qui s'articule en systèmes ( environnement , mobilité , lieux centraux , résidences , production ) et qui mène une réflexion sur les prestations des différentes parties de ville ( début de l' étude , 1996 ; adoption du plan , 1998 ). "
55,,,,,,," ,Il territorio come palinsesto,,","[5] André Corboz ,  ,Il territorio come palinsesto,, Casabella , n° 516 , septembre 1985 . "
58,,,,,,," d' art et de villes,, introduction à André Corboz , Ordine Sparso , Saggi sull'arte , il metodo , la città e il territorio ,","[7] Paola Viganò , ,André Corboz , connaisseur  d' art et de villes,, introduction à André Corboz , Ordine Sparso , Saggi sull'arte , il metodo , la città e il territorio , Milano , Franco Angeli , 1998 . "
59,,,,Le texte,,, la ville au patrimoine urbain.,"Le textea été partiellement traduit et publié comme postface de l' anthologie d' André Corboz , De  la ville au patrimoine urbain. "
60,,,,,,," Histoires de forme et de sens ,"," Histoires de forme et de sens , Québec , Presses de l' université du Québec , 2009 . "
61,,,,,,," conoscitore d' arte [Le connaisseur d' art],","[8] Max Friedländer , Il  conoscitore d' arte [Le connaisseur d' art], Milan , Tea Arte , 1995 ( 1946 ). "
63,,,,,,," s'intensifie ,","À la fin des années 1990 , mon activité universitaire  s'intensifie , je deviens professeure associée à l' École polytechnique  de Bari en 1998 . "
64,,,,,,, l' un des grands sites industriels désaffectés ,"Avec un groupe de collègues constitué en une équipe , under 40 ,, j'ai gagné un important concours international à Milan pour  l' un des grands sites industriels désaffectés  du nord de l' agglomération , à Sesto San Giovanni( la , Stalingrad d' Italie ,). "
65,,,,,,, un grand parc qui suivrait les rails ,"Avec un projet très conceptuel , mais tout de même simple , nous avons proposé de commencer par  un grand parc qui suivrait les rails  ( dans la partie que nous supposions la moins polluée , faute de données sur l' histoire environnementale du site ). "
66,,,,,,, structurer le projet .,"Le parc maximisait , grâce à sa longueur et à sa forme , sa capacité de  structurer le projet . "
67,,,,,,," ce morceau de ville imaginée ,","L'un des tissus à petits grains de  ce morceau de ville imaginée , vaste comme le centre de Milan , a alors été désigné , ville poreuse ,. "
68,,,,,,, la dispersion .,"C'était une écologie spécifique , reprenant un terme qui était déjà présent dans les interprétations que , avec Bernardo Secchi , nous construisions sur les territoires de  la dispersion . "
69,,,,,,, la flexibilité et la disponibilité au changement ,"Ces termes , qui décrivaient  la flexibilité et la disponibilité au changement  de ces territoires , reviendront à plusieurs reprises : dans le Salento , à Anvers , dans le Grand Paris . "
70,,,,,,," l' ancienne sidérurgie , il nous est apparu clair que rien ne se passerait .","Après les premiers échanges avec le maire de Sesto San Giovanni et les propriétaires du site , les grands patrons de  l' ancienne sidérurgie , il nous est apparu clair que rien ne se passerait . "
71,,,,,,, n'a toujours pas évolué .,"Aujourd'hui , après quinze ans et de nombreuses enquêtes judiciaires , la situation  n'a toujours pas évolué . "
72,,,,,,, j'ai donc enseigné trois ans ,"À la même époque ,  j'ai donc enseigné trois ans  dans le sud de l' Italie , à Bari , poussée par une forte curiosité et un intérêt grandissant pour un territoire méditerranéen qui m'était à la fois proche et culturellement distant . "
73,,,,le plan territorial,,, élaborantle plan territorialde la région du Salento et de la province de Lecce au sud de Bari.,"J'ai longuement réfléchi sur ce territoire ,  élaborantle plan territorialde la région du Salento et de la province de Lecce au sud de Bari. "
74,,,,Le plan du <lieu type,,, un territoire diffus.,Le plan du =obj>Salento a été la première occasion d' imaginer un projet concret et innovant pour  un territoire diffus. 
75,,,,,,, l' étalement urbain ,"Il s'agissait de sortir d' une série d' idées reçues sur  l' étalement urbain  comme sur le sud de l' Italie , de se doter de nouveaux outils conceptuels pour repenser l' urbanisme et particulièrement le projet devenu implicite de l' urbanisme moderne , dépassé , mais aussi complètement intégré dans la bureaucratie des villes , notamment dans la pratique du zoning et des règles non discutées et tout simplement imposées . "
76,,,,,,, Le changement de paradigme était possible dans un territoire où des traces archaïques , Le changement de paradigme était possible dans un territoire où des traces archaïques  coexistaient avec une modernité non orthodoxe et nouvelle . 
77,,,,,,, d' un projet innovant ,"Dans l' introduction au livre Territori di una nuova modernità / Territories of a New Modernity qui synthétise l' effort d' une équipe riche et très articulée , je voulais surtout communiquer la possibilité  d' un projet innovant  à partir d' un contexte diffus , traditionnellement considéré sous-développé , ( car ) sous-infrastructuré . "
78,,,,,,," Un projet où des dynamiques de diffusion et de concentration pouvaient ne pas s'opposer , mais au contraire développer des conditions multiples d' habitat et d' économie ,"," Un projet où des dynamiques de diffusion et de concentration pouvaient ne pas s'opposer , mais au contraire développer des conditions multiples d' habitat et d' économie , de diffusion de la naturalité , de génération diffuse d' énergie , d' itinéraires narratifs et , finalement , une qualité de vie élevée . "
79,,,,"Le plan territorial du Salento , étudié entre 1999 et 2001",,, projet de territoires diffus ,"Le plan territorial du Salento , étudié entre 1999 et 2001, a été un manifeste du  projet de territoires diffus  et en même temps un nouveau programme pour la recherche urbaine et territoriale. "
80,,,,,,, una nuova Modernità/Territories ,"[9] Paola Viganò , ed ., Territori di  una nuova Modernità/Territories  of a new Modernity , Naples , Electa , 2001 ; "
81,,,,,,," Territory of a New Modernity ,","Bernardo Secchi , Paola Viganò , Antwerp –  Territory of a New Modernity , Amsterdam , SUN , 2009 ; "
82,,,,,,, La Ville poreuse ,"Bernardo Secchi , Paola Viganò ,  La Ville poreuse  – Un projet pour le Grand Paris et la métropole de l' après-Kyoto , Genève , MetisPresses , 2011 . "
84,,,,plan territorial pour <lieu type,,,plan territorial pour =obj>la province de Lecce ,"Page de gauche : Salento  Le Salento  : plan territorial pour =obj>la province de Lecce  ( première phase , 1999-2001 ; "
87,,,,Le schéma,,, renovatio urbis ,"Le schémas'appuie sur la stratégie de  renovatio urbis  et sur l' élaboration de scénarios , ,ce qui pourrait arriver si...,, proposant de grandes ,images,, à actualiser et inédites , enracinées dans l' histoire de la ville ( appel d' offre , 2003 ; "
89,,,,,,," l' université IUAV de Venise , où je continuais de travailler dans le cadre du collège du doctorat en urbanisme.","Au début des années 2000 , j'ai été appelée à  l' université IUAV de Venise , où je continuais de travailler dans le cadre du collège du doctorat en urbanisme. "
90,,,,,,," l' École polytechnique fédérale  de Lausanne , à l' école d' architecture d' Aarhus au Danemark , et surtout en Belgique , où j'ai enseigné cinq ans à la KU Leuven et , plus tard , dans son homologue wallonne , l' université catholique> de Louvain-la-Neuve , et enfin , plus récemment à la Harvard Graduate School of Design .","Les années suivantes , j'ai été invitée dans plusieurs universités : à  l' École polytechnique fédérale  de Lausanne , à l' école d' architecture d' Aarhus au Danemark , et surtout en Belgique , où j'ai enseigné cinq ans à la KU Leuven et , plus tard , dans son homologue wallonne , l' université catholique> de Louvain-la-Neuve , et enfin , plus récemment à la Harvard Graduate School of Design . "
91,,,,,,, type=obj>l' espace urbain et son projet .,"En 2005 , avec des collègues de type=obj>Venise , de type=obj>Louvain , de type=obj>l' université de t> technologie de typet>=obj> t>Dt>elft ( type=obj>TU t>Dt>elft ) et de type=obj>l' université polytechnique de Catalogne ( UPC de type=obj>Barcelone), j'ai contribué à la création du master européen en urbanisme ( EMU ), centré sur  type=obj>l' espace urbain et son projet . "
92,,,,,,," L'ambition était de valoriser une tradition européenne en urbanisme ,"," L'ambition était de valoriser une tradition européenne en urbanisme , peu lisible , fractionnée comme elle l' est dans les cadres et les pratiques nationales et locales . "
94,,,,,,, quelques invitations à participer à des concours ,"Durant cette même période ,  Studio  ( qui change son nom tous les ans : cette année Studio  013 ) profite de  quelques invitations à participer à des concours  en Europe pour s'éloigner de l' atmosphère désormais trop opaque du contexte professionnel italien . "
95,,,,"le plan directeur du projet Ville-Port à Saint-Nazaire ,",,," le projet de la Zac de La Courrouze à Rennes , sur laquelle nous travaillons depuis dix ans ; en Belgique , le parc de Spoor Noord et la place du Théâtre à Anvers conjointement à la conception du plan directeur de la ville , le système d' espaces publics du centre-ville de Malines ,","Parmi les concours gagnés , on compte notammentle plan directeur du projet Ville-Port à Saint-Nazaire , le projet de la Zac de La Courrouze à Rennes , sur laquelle nous travaillons depuis dix ans ; en Belgique , le parc de Spoor Noord et la place du Théâtre à Anvers conjointement à la conception du plan directeur de la ville , le système d' espaces publics du centre-ville de Malines , les projets dans le centre éducatif De Hoge Rielen à Kasterlee et , auparavant l' expérience de Courtrai avec la réalisation de la grand-place , du cimetière et du projet urbain de la ville... "
96,,,,,,, l' occasion de formuler des hypothèses à travers des projets .,"Tous ont été , à chaque fois ,  l' occasion de formuler des hypothèses à travers des projets . "
99,,,,,,," The American Planning Tradition , Culture and Policy ( Robert Fishman ed ., Woodrow Wilson ","Mais il n'existe pas , dans le contexte européen un livre comme  The American Planning Tradition , Culture and Policy ( Robert Fishman ed ., Woodrow Wilson  Center Press , Washington , DC , 2000 ). "
103,,,,,,," réalisation des rues et places minérales ,","De la Veemarkt jusqu'à la cathédrale de Saint-Rombouts , les espaces ouverts traversent le cercle plus interne et ancien de la ville ( projet lauréat du concours , 2000 ,  réalisation des rues et places minérales , 2003-2005 ; "
104,,,,,,, Imaginer le futur ,"place paysagère et parking souterrain derrière la cathédrale , 2012 )  Imaginer le futur  Le livre Les Territoires de l' urbanisme . "
105,,,,,,," Le projet comme producteur de connaissance ,"," Le projet comme producteur de connaissance , publié après une longue gestation en 2010 et traduit en français en 2011 , a été , pour moi , un effort nécessaire . "
106,,,,,,," d' étude sur le Design Thinking ,","Bien qu'il existât déjà une tradition  d' étude sur le Design Thinking , j'ai voulu me positionner différemment en explorant en même temps la tradition urbanistique et ma propre expérience de projet . "
107,,,,des plans et des projets d' urbanisme,,, redessinant.,"La représentation et le dessin y jouent un rôle fondamental , qu'il s'agisse de liredes plans et des projets d' urbanisme, ou de les redécouvrir en les  redessinant. "
108,,,,,,," La construction de connaissance passe à travers des opérations complexes de description , de conceptualisation et de formulation d' hypothèses et construction de scénarios ."," La construction de connaissance passe à travers des opérations complexes de description , de conceptualisation et de formulation d' hypothèses et construction de scénarios . "
109,,,,,,, futur ,"Durant ces dernières années , je me suis énormément intéressée au problème du  futur  dans le projet de la ville . "
110,,,,,,, l' idée de proposer une vision aux territoires n'émerge de nouveau dans les discours et les politiques urbaines .,"Ce questionnement a d' abord traversé la recherche ( menée surtout dans le cadre du doctorat d' urbanisme à Venise), avant même que  l' idée de proposer une vision aux territoires n'émerge de nouveau dans les discours et les politiques urbaines . "
111,,,,,,," le Grand Paris , Bruxelles 2040 , Lille 2030 ,","Je considère avoir eu l' immense privilège d' étudier des , visions , pour  le Grand Paris , Bruxelles 2040 , Lille 2030 , la Nouvelle Moscou et aujourd'hui Montpellier 2040 . "
